id,title,ISBN13,pages,authors,publisher,date
1763,Structure & Style Java.,9780812281033,288,J. Joseph Errington,Scholarly Book Services Inc,June 27th 2002
1764,C# for Java Programmers,9781281056016,613,"Brian  Bagnall,Philip Chen,Stephen Goldberg,Jeremy Faircloth,Harold Cabrera",Syngress Publishing,January 10th 2010
1765,Programming in Java (BP),9780859344364,192,Mark Walmsley,Bernard Babani Publishing,May 30th 1998
1766,Night Over Java,,168,John Fabricius,Greenberg,1946
1767,The Official VisiBroker for Java Handbook [With *],9780672314513,528,"Michael McCaffery,William Scott",Sams,January 8th 1999
1768,Java 2: Beyond the Buttons,9780620333955,764,Robin Knox-Grant,Virtualbookworm.com Publishing,August 1st 2006
1769,Java Internet Programming Lab,9780761510130,500,Eric Richardson,Prima Publishing,March 31st 1997
1770,Object Oriented Programming with JAVA,,678,"Upendra K. Tiwari,Dilkeshwar Pandey",Acme Learning Private Limited,November 30th 2009
1771,Java Time! for Women,9781581690965,176,Anne Johns,Evergreen Press (AL),July 1st 2002
1772,La Java Bleue,9782882582614,32,Albertine,Joie de lire,2003
1773,Java Heterogeneous Distributed Computing,9785512417096,84,"Jesse Russell,Ronald Cohn",Book on Demand Ltd.,July 8th 2012
1774,Pro Ajax and Java Frameworks,9781280726927,313,"Ryan Asleson,Nathaniel T Schutta",Apress,August 17th 2009
1775,Schrödinger programmiert Java,,704,Philip Ackermann,Galileo Press,2013
1776,Java and Internet Security,9780595135004,208,"Theodore Shrader,Theodore J. Shrader,Bruce A. Rich,Bruce Rich,Theodore Shrader",iUniverse,October 1st 2000
1777,Java For Ap Computer Science,9780921598510,0,"Tom West,Christine Stephenson",Holt Software Assoc Inc,September 30th 2003
1778,Workshop Java EE 7,,,Marcus Schießer,,
1779,Java Generics And Collections,,308,Naftalin,,October 12th 2006
1780,Das Programmierbuch Java,9783815572252,821,Unknown Author 702,Sybex,1996
1781,"Java by Example, with CD-ROM",9780789708144,,Clayton Walnum,Que,June 1st 1996
1782,Java Quick Reference,9780789708687,430,Mike Afergan,Que,July 31st 1996
1783,Java Enterprise Design Patterns,9781280314070,486,Mark Grand,John Wiley & Sons,January 9th 2009
1784,Kryptografie mit Java,9783772371080,,"Herbert Voss,Herbert  Voß",,
1785,From Jarrow to Java,,,Joe  Writeson,,April 9th 2014
1786,Java. Ćwiczenia zaawansowane.,,176,Marcin Lis,Helion,January 18th 2012
1787,Wireless Java for Symbian Devices,9780471486848,512,"Jonathan Allin,Alan Robinson",John Wiley & Sons,October 8th 2001
1788,Rambles In Java And The Straits in 1852,9780195888584,139,Charles Walter Kinloch,Oxford University Press,1989
1789,Inside Web Dynpro For Java,9781592290925,,Chris Whealy,"SAP PRESS, 2nd edition",November 30th 2007
1790,Understanding Java Telephony,9781578200030,873,Edwin Margulies,CMP Books,January 31st 1997
1791,Formal Syntax and Semantics of Java,9783540661580,410,James Alves-Foss,Springer,June 9th 1999
1792,java script basics,,,Ahmed,,December 5th 2010
1793,Java Web Magic with CD,9781568303413,256,Joseph T. Sinclair,Hayden Books,January 1st 1997
1794,Java for COBOL Programmers [With CDROM],9781886801844,432,John C. Byrne,Delmar Thomson Learning,February 1st 2000
1795,Java in Onze Kunst,,254,Gerard Brom,W.L. & J. Brusse N.V.,1931
1796,뇌를 자극하는 JAVA 프로그래밍,9788979143973,908,김윤명,한빛미디어,March 7th 2010
1797,Sony Ericsson Java Platform,9785512414378,150,"Jesse Russell,Ronald Cohn",Book on Demand Ltd.,September 22nd 2012
1798,The Birds Of Java And Bali,9780195889277,,Derek Holmes,Oxford Univ Pr (Txt),
1799,Programming Games with Java,9781937161378,940,"Philip Conrod,Lou Tylee",Kidware Software,February 13th 2013
1800,Java Nightmare: An Autobiography,9781844264865,196,Daphne Jackson,Upfront Publishing,April 1st 2008
1801,A Java GUI Programmer's Primer,9780139088490,322,"Fintan Culwin,Dintan Culwin",Prentice Hall,January 1st 1998
1802,Java Tools for Developers,,331,Cheng-Hung Chou,,May 14th 2013
1803,Java Web Services,9783827322319,,Manfred Hein,,
1804,Checking Java Programs,9780596510237,54,Ian F Darwin,O'Reilly Media,March 30th 2007
1805,Il Linguaggio Java,,,Massimiliano Bigatti,,
1806,Beginning Java and Flex,9781430223863,437,Filippo di Pisa,Apress,December 31st 2009
1807,Traditional Music in Modern Java,9780824805630,254,Judith O. Becker,"University of Hawaii Press, The",January 1st 1980
1808,Gingerbread 'n Java,9781503105737,44,Annie Lang,Annie Things Possible Publications,November 4th 2014
1809,Cohoon Java Program Design,9780072961133,919,James P. Cohoon,McGraw-Hill Higher Education,January 1st 2006
1810,Java and Mac OS X,9780470647325,512,T. Gene Davis,Wiley,March 30th 2010
1811,Java Design and Development,9781904284024,500,Expert Books,Expert Books,May 20th 2002
1812,Java Soa Cookbook,9781306814782,579,Eben Hewitt,O'Reilly Media,May 28th 2014
1813,Java Network Security,9780137615292,232,Robert S. MacGregor,Prentice Hall,January 1st 1998
1814,Das Java   Praktikum,9783898645133,,Reinhard Schiedermeier,,
1815,Java Virtual Machines & Applications,9781280266461,58,Lynn Escobar,Learning Press,January 1st 2012
1816,Beginning Java Networking,9781861005601,848,"Chad Darby,William Wright",Wrox Press,September 29th 2001
1817,Einstieg In Java 6,9783836213790,,Bernhard Steppan,,
1818,Java Y XML/ Java and XML (De Programadores Para Programadores),9788441513549,848,Mohammad Akif,Anaya Multimedia,September 30th 2002
1819,Java Applet Games - A Beginners Guide to Creating Games in Java TEASER,,31,Donny Bridgen,,February 3rd 2012
1820,"Java for Business: Using Java to Win Customers, Cut Costs, and Drive Growth",9780442025175,354,Thomas Anderson,Van Nostrand Reinhold Company,January 1st 1997
1821,Object First with Java&aw Java Bckpk Ref GD,9780135038260,,Pearson,Pearson,January 1st 2009
1822,Programming with Java IDL: Developing Web Applications with Java and CORBA,9780471247975,336,Geoffrey Lewis,Wiley,November 26th 1997
1823,Learn Java for Android Development: Java 8 and Android 5 Edition,9781430264569,1200,Jeff Friesen,Apress,May 21st 2014
1824,"Java - The Fast Way: The Ultimate, Quick and Easy Java Programming Guide",,65,Alexander Mosgov,,April 11th 2015
1825,Essential Java Fast: How to Write Object Oriented Software for the Internet in Java,9783540760528,186,John Cowell,Springer,February 18th 1997
1826,"PROGRAMMER EN JAVA, 6E ÉDITION JAVA 5 ET 6",,,Claude Delannoy,EYROLLES,
1827,"Complete Java Training Course, Student Edition, Java 1.1",9780130829276,1264,Harvey M. Deitel,Prentice Hall PTR,August 10th 1998
1828,"Java and Her Neighbors: A Traveler's Notes in Java, Celebes, the Moluccas and Sumatra",9780548375112,368,Arthur S. Walcott,Kessinger Publishing,June 1st 2007
1829,Batik: Sukma Jawa = De Ziel Van Java = The Soul Of Java,9789070962265,192,Fred W. van Oss,"Dikeluarkan oleh Nederlands Textielmuseum dalam rangka kerjasama dengan Museum Tekstil, Jakarta, Ind",1996
1830,J2EE/Java EE Kompakt: Enterprise Java: Konzepte Und Umfeld,9783827415929,132,"Arne Koschel,Stefan Fischer,Gerhard Wagner",Spektrum Akademischer Verlag,July 1st 2006
1831,Pro EJB 3: Java Persistence API (Expert's Voice in Java),,480,"Mike Keith,Merrick Schincariol",,
1832,Workshop Java EE 7 Ein praktischer Einstieg in die Java,,376,"Marcus Schießer,Martin Schmollinger",dpunkt.verlag,July 25th 2013
1833,"Programmation Internet Avec Html, Xhtml, Java Script &Amp; Java 2",9782744009846,941,Michel Martin,CampusPress,2000
1834,Functional Java: A Guide to Lambdas and Functional Programming in Java 8,,208,Nick Maiorano,ThoughtFlow Solutions inc.,April 26th 2014
1835,Pemrograman Java untuk Aplikasi Basis Data dengan Teknik XP Menggunakan IDE Eclipse (Paperback),9789792900910,,Adi Nugroho,"Penerbit Andi, Yogyakarta",2007
1836,JAVA :INTERVIEW QUESTION & ANSWER: JAVA FOR FRESHER AND EXPERIENCE,,29,R KUMARI,,June 28th 2016
1837,Java Pocket Guide: Instant Help for Java Programmers,9781491938690,256,Liguori,O'Reilly Media,February 25th 2017
1838,"Java for Everyone: Compatible with Java 5, 6, and 7",9781119031017,624,Cay S Horstmann,Wiley,July 15th 2016
1839,Java Enterprise Design Patterns: Patterns in Java,9780471267829,496,Mark Grand,Wiley,July 4th 2002
1840,Java by Dissection: The Essentials of Java Programming [With On to C Book],9780201751581,509,Ira Pohl,Addison Wesley Publishing Company,June 23rd 2001
1841,Hands on Java Beans Hands on Java Beans,9780761510475,445,Mitch Allen,Premier Press,January 1st 1997
1842,Art & Science of Java&backpack Ref Java Pkg,9780321508898,,Pearson,Pearson,January 1st 2009
1843,Beginning Java with WebSphere (Expert's Voice in Java),,556,Robert W. Janson,Apress,September 24th 2013
1844,Java Gems: Jewels from Java Report,9780139048630,248,"Deugo,Dwight Deugo",Sigs,January 1st 1998
1845,Advanced Java 2nd Edition with Enterprise Java Set,9780471443841,,Daniel J. Berg,Wiley,February 2nd 2001
1846,Java and Her Neighbours a Traveller's Notes in Java,9785518571686,506,Arthur Stuart Walcott,Book on Demand Ltd.,June 4th 2013
1847,"Distributed Java: Remote Objects for Java, with CDROM",9780079132499,304,Bret Sommers,McGraw-Hill Companies,November 1st 1997
1848,Java-Programmierung - Das Handbuch zu Java 8,,1100,"Guido Krüger,Heiko Hansen",O'Reilly Verlag,August 4th 2014
1849,Java Enterprise Design Patterns: Patterns in Java: 3,,496,Mark Grand,Wiley,November 19th 2001
1850,Effective Java (2nd Edition) (Java Series),9781515367208,144,Jasmine C Wade,Createspace,August 6th 2015
1851,"The Java Language Specification, Java Se 7 Edition",9780133260304,672,"James Gosling,Bill Joy,Guy L Jr Steele",Addison-Wesley Professional,February 8th 2013
1852,Java: : Learn Complete Java Programming with Fun.,9781502361745,584,Harry H. Chaudhary,Createspace,September 12th 2014
1853,Java elements: Elements of Java for the principled programmer,9780072374483,332,Duane A. Bailey,McGraw-Hill,1999
1854,Programación en Java: Desarrolla Aplicaciones Java,,193,Andrés Serbat Ocaña,,April 26th 2014
1855,Hands On Java: A Self Study Introduction To Java Programming,9781874107064,,Alistair Stewart,,
1856,Absolute Java & Java Backpk Ref& Mycodemate,9780136120711,,Pearson,Pearson,January 1st 2009
1857,Real-Time Java Programming: With Java Rts,9780137042562,431,"Eric Bruno,Greg Bollella",Prentice Hall Professional,June 1st 2009
1858,Do You Speak Java ?: Java Language Fundamentals,9781522760214,188,MR Aleks Rudenko,Createspace Independent Publishing Platform,February 10th 2016
1859,Buildg Java Program&backpack Referencg Java,9780321507983,,Pearson,Pearson,January 1st 2009
1860,Modern Java: Java 7 and Polyglot Programming on the Jvm,9781494973988,142,Adam L. Davis,Createspace,February 2nd 2014
1861,"The Java Language Specification, Java SE 8 Edition",,798,James Gosling,Pearson Education,
1862,Big Java/Java Compiler CD 2002,9780471232803,0,Cay S. Horstmann,Wiley,March 29th 2002
1863,Real World Java 2 with CDROM (Java Masters),,376,Justin Couch,McGraw-Hill Companies,
1864,JAVA EASY LEARNING: Advanced Java JEE,,235,K.V Rao,ASHOK,October 23rd 2014
1865,Java Please!: A Workbook Exploring Java Programming,9781588743343,161,James G. Janossy,Stipes Pub Llc,March 31st 2004
1866,Java Recipes: Delicious Java Recipes For Every Occasion.,,36,Arthur Devalle,MOONEY VISION,March 5th 2016
1867,"Java EE 6 Cookbook for Securing, Tuning, and Extending Enterprise Applications",9781849683166,356,Mick Knutson,PACKT Publishing,June 2012
1868,"Daendels and the Sacred Space of Java, 1808-1811: Political Relations, Uniforms and the Postweg",,32,Peter  Carey,"Vantilt, Uitgeverij",March 2013
1869,Women of the Kakawin World: Marriage and Sexuality in the Indic Courts of Java and Bali,9780765601599,,Helen Creese,Routledge,October 27th 2004
1870,Sutasoma: The Ancient Tale of a Buddha-Prince from 14th Century Java,9789745241077,332,Kate   O'Brien,Orchid Press,May 1st 2008
1871,Java Ee 5 Development Using Glassfish Application Server,9781847192608,424,David Heffelfinger,Packt Publishing,September 30th 2007
1872,"Spring, Hibernate, Data Modeling, REST and TDD:Agile Java Design and Development",,500,Amritendu De,,January 11th 2015
1873,A Laboratory Course for Programming in Java (Jones and Bartlett Books in Computer Science),9780763724634,311,Nell B. Dale,Jones & Bartlett Publishers,February 11th 2005
1874,"Lists of Subdistricts of Indonesia: Subdistricts of East Java, Subdistricts of West Java, Subdistricts of Central Java",9781155900018,188,Books LLC,Books LLC,September 15th 2010
1875,"The Java Class Libraries Poster, Fifth Edition: Covering the Java 2 Platform, Standard Edition, v1.3 (The Java Series)",,2,"Patrick Chan,Rosanna Lee",Addison Wesley Publishing Company,June 2nd 2000
1876,Java for Black Jack: Learn the Java Programming Language in One Session by Writing and Running a Java-Based Card Game Simulation,,,U.Q. Magnusson,"U.Q. Media Group, LLC",June 27th 2014
1877,"The Java EE 7 Tutorial, Volume 2",9780321980083,628,"Eric Jendrock,Ian Evans,Devika Gollapudi,Kim Haase,Chinmayee Srivathsa,Ricardo Cervera-Navarro,William Markito",Addison-Wesley Professional,May 17th 2014
1878,"Java, Indonesia and Islam (Muslims In Global Societies Series)",9789400700550,275,Mark R. Woodward,Springer,November 5th 2010
1879,Data Structures and Other Objects Using Java,9780132911504,848,Michael Main,Pearson Educacion,October 1st 2011
1880,Developing Java Ee 6 Applications on Jboss As7,9781782161349,326,Francesco Marchioni,Packt Publishing,March 28th 2013
1881,"Land, Labour, and Livelihood in a West Java Village",9789794200711,323,Joan Hardjono,Gadjah Mada University Press,December 1st 1988
1882,250 Multiple Choice Computer Science Questions In Java,9780972705592,,Maria Litvin and Gary Litvin,,
1883,The Cert Oracle Secure Coding Standard for Java,9780132882859,733,Fred Long,Addison-Wesley Professional,September 6th 2011
1884,Java Program Design with Olc Bi Card,9780072921960,904,"James P. Cohoon,Jack W. Davidson",McGraw-Hill Science/Engineering/Math,July 22nd 2003
1885,Java 1.2 and JavaScript for C and C++ Programmers,9780471183594,704,Eric Monk,Wiley,February 18th 1998
1886,Embedded Java Security: Security for Mobile Devices,9781846285905,243,Mourad Debbabi,Springer,December 18th 2006
1887,Thinking in Java.: Special Beginner's Edition 2014.,9781499651478,830,Harry H. Chaudhary,Createspace,May 21st 2014
1888,Sun Certified Java Programmer Practice Test,9780558171957,,Sun Microsystems,Pearson Learning Solutions,April 26th 2009
1889,Flora of Java: Spermatophytes Only : Vol III (Hardcover),,761,"C.A. Backer,R.C. Bakhuisen van den Brink",Wolter-Noordhoff (1968),1968
1890,Java Ee 7 with Glassfish 4 Application Server,9781782176893,348,David R. Heffelfinger,Packt Publishing,March 26th 2014
1891,Programming Fundamentals Using Java: A Game Application Approach,9781938549762,733,"William Mcallister,Sister Jane Fritz",Mercury Learning & Information,September 29th 2014
1892,Introduction to Java Programming with Sun One Studio 4,9780130092588,,Y. Daniel Liang,Prentice Hall,September 3rd 2002
1893,"Java: Java in 8 Hours, Java for Beginners, Learn Java Fast!: A Beginner's Guide",9781514752241,240,"Ray Yao,Ada R Swift,Ruby C Perl",Createspace,June 28th 2015
1894,"Plateforme Java: Java, Eclipse, Machine Virtuelle Java, Bytecode Java, Swing, Abstract Window Toolkit, Standard Widget Toolkit",9781159886585,98,Source Wikipedia,"Books LLC, Wiki Series",September 2nd 2011
1895,"Java for Beginner's Crash Course: Java for Beginners Guide to Program Java, Jquery, & Java Programming",9781522756330,140,Quick Start Guides,Createspace Independent Publishing Platform,December 14th 2015
1896,Supplement: Java How to Program & Java How to Program CD - Java How to Program & Java How to Program,9780131541603,,"Harvey M. Deitel,Paul J. Deitel",Prentice Hall,
1897,"Java: The Simple Guide to Learn Java Programming in No Time (Programming, Database, Java for Dummies, Coding Books, Java Programming)",9781533419132,50,"David Hoffman,Java for dummies,Java Programming",Createspace Independent Publishing Platform,May 27th 2016
1898,"JAVA: Easy Java Programming for Beginners, Your Step-By-Step Guide to Learning Java Programming (Java Series)",,114,Felix Alvaro,,March 25th 2016
1899,"JAVA, Java Script and HTML : Learn In A Day: Computer Programming Language (HTML, JAVA, Java Script)",,87,Os Swift,,April 10th 2016
1900,Oca/Ocp Java Se 7 Programmer I & II Practice Exams (Exams 1z0-803 & 1z0-804),9780071828109,,"Bert Bates,Kathy Sierra",McGraw-Hill/Osborne Media,January 31st 2016
1901,"Java Tools for Extreme Programming: Mastering Open Source Tools, Including Ant, Junit, and Cactus",9780471207085,544,Richard Hightower,John Wiley & Sons,November 27th 2001
1902,Practical JRuby on Rails Web 2.0 Projects: Bringing Ruby on Rails to the Java Platform,9781590598818,330,Ola Bini,Apress,September 26th 2007
1903,Sun Certified Web Component Developer Study Companion Java EE 5 (SCWCD Exams 310-083 and 310-084) 2nd Edition,9780955160332,621,Charles Lyons,GARNER PRESS,July 9th 2009
1904,Automatic Java Code Generator for Regular Expressions and Finite Automata,,63,Suejb Memeti,Suejb Memeti,October 26th 2012
1905,Java Development on PDAs: Building Applications for PocketPC and Palm Devices,9780201719543,256,Daryl Wilding-McBride,Addison Wesley Publishing Company,June 14th 2003
1906,Teach Yourself Internet Game Programming with Java in 21 Days: With CDROM,9781575211480,416,Michael Morrison,Sams,August 1st 1996
1907,OSGi and Equinox: Creating Highly Modular Java Systems (Eclipse Series),,460,"Jeff McAffer,Paul VanderLei,Simon Archer",,
1908,Pro J2ME Polish: Open Source Wireless Java Tools Suite,9781590595039,450,Robert Virkus,Apress,July 28th 2005
1909,Platinum Edition Using HTML 3.2 Java 1.1 and CGI,9780789709325,1471,"Eric Ladd,Jerry Ablan,Tobin Anthony",Que,January 1st 1996
1910,"Java 2 Platform, Enterprise Edition: Platform and Component Specifications",9780201704563,748,"Enterprise Team,Mark Hapner,Vlada Matena",Addison-Wesley Professional,May 30th 2000
1911,Core Java Programming in Easy Steps 2013 (Programming In Core Java with easy styles 2013),,433,Er Harry,Er. Harry (Java Research Labs),July 28th 2012
1912,Java/J2ee Design Patterns Interview Questions You'll Most Likely Be Asked,9781461016670,110,Vibrant Publishers,Createspace,March 19th 2011
1913,"JAVA: JAVA for Beginners, Learn Java fast! A smart way to learn Java. Plain & Simple. JAVA programming, Learn JAVA in easy steps, Start coding today: Java, A Beginner's Guide, Fast & Easy!",,326,"Ray Yao,Ruby C. Perl,Ada R. Swift",Rails Excel SharePoint Web Access Database Flash Lamp ActionScript Language,July 8th 2015
1914,Gotong Rojong: Some Social-Anthropological Observations on Practices in Two Villages of Central Java,9786028397278,100,"Koentjaraningrat,Claire Holt",Equinox Publishing (Indonesia),July 15th 2009
1915,"Plataforma Java: Java, Openjdk, Icedtea, Superwaba, RMI, J2ee Connector Architecture, Jxta, Javafx Script, Vaadin, Java Me, Java Card,",9781231474495,44,Source Wikipedia,"Books LLC, Wiki Series",June 26th 2011
1916,"Enterprise Edition Topics: "" Effective Java Programming Language Guide "" , "" Inside Java 2 Platform Security "" , "" Concurrent Programming In Java "" , "" Java Platform Performance """,9780201787382,,Inc Sun Microsystems,,
1917,"Merdeka Rising: Part Two of Black Sun, Red Moon: A Novel of Java",9780957630543,334,Rory Marron,Seventh Citadel,December 7th 2013
1918,"Data Structures and Software Development in an Object Oriented Domain, Java Edition",9780137879533,1200,"Jean-Paul Tremblay,Grant A. Cheston",Prentice Hall,August 5th 2002
1919,The Pesantren Tradition: The Role of the Kyai in the Maintenance of Traditional Islam in Java,9781881044192,253,Zamakhsyari Dhofier,Arizona State University Program for Southeast Asian Monogra,January 1st 1999
1920,Java Developer's Guide to E-Commerce with XML & JSP [With 1 CD],9780782128277,464,"William B. Brogden,Chris Minnick",Sybex,January 16th 2001
1921,Learn to Program with Minecraft Plugins: Create Flaming Cows in Java Using CanaryMod,,285,Andy Hunt,Pragmatic Bookshelf,October 29th 2014
1922,Sams Teach Yourself Java 1.2 In 21 Days (Sams Teach Yourself),9781575213903,,"Laura Lemay,Rogers Cadenhead",Sams,July 1st 1998
1923,Power Plays: Wayang Golek Puppet Theater of West Java,9780896802407,320,Andrew N. Weintraub,Ohio University Press,November 22nd 2004
1924,Building Mobile Applications with Java: Using the Google Web Toolkit and PhoneGap,9781449308230,86,Joshua Marinacci,O'Reilly Media,March 21st 2012
1925,Coffee With Pleasure: Just Java and World Trade,9781551641904,194,"Laure Waridel,Eric St. Pierre",Black Rose Books,June 1st 2001
1926,The Complete Guide to Java Database Programming with FDBC,9780079132864,333,"Matthew D. Siple,McGraw-Hill Education",McGraw-Hill Companies,December 1st 1997
1927,Java for Beginners with Eclipse 4.2 Juno (Pemograman),,136,"Alfa Satyaputra,Eva Maulina Aritonang",Elex Media Komputindo,November 21st 2012
1928,Java Programming - Step by Step Video Tutorial for Beginners,,400,Patrick Washington,PatrickVideos.com,February 24th 2013
1929,Smart Card Application Development Using Java,9783540432029,305,Martin S. Nicklous,Springer,July 1st 2002
1930,Apache Jakarta and Beyond: A Java Programmer's Introduction [With CDROM],9780321237712,582,Larne Pekowsky,Addison-Wesley Professional,January 9th 2005
1931,Embodied Communities: Dance Traditions and Change in Java,9781845452384,304,Felicia Hughes-Freeland,Berghahn Books,November 8th 2010
1932,JDBC Database Access with Java: A Tutorial and Annotated Reference,9780201309959,462,"Rick Cattell,Graham Hamilton,Maydene Fisher",Addison Wesley Publishing Company,June 1st 1997
1933,"Shadow Theatre in Java: The Puppets, Perfomance and Repertoire",9789054960348,152,Alit Djajasoebrata,Pepin Press,February 28th 1999
1934,"Martin Mystère n. 296: Java, addio!",,160,"Paolo Morales,Davide De Cubellis,Giancarlo Alessandrini",Sergio Bonelli Editore,April 1st 2008
1935,Teach Yourself Java in Cafe in 21 Days: With CDROM,9781575211572,750,"Daniel I. Joshi,Laura Lemay,Charles L. Perkins",Sams.net,July 1st 1996
1936,"Java 2, V5.0 (Tiger) New Features",9780072258547,198,Herbert Schildt,McGraw-Hill/Osborne Media,July 4th 2004
1937,Osgi and Equinox: Creating Highly Modular Java Systems,9780321609434,509,"Jeff McAffer,Paul VanderLei,Simon Archer",Addison-Wesley Professional,February 15th 2010
1938,Structures De Données En Java,9782100069378,,John R.  Hubbard,,
1939,Java Server Pages from Scratch,9780789724595,404,Maneesh Sahu,Que,October 19th 2000
1940,Imagine! Java: Programming Concepts in Context,,1008,Frank M. Carrano,Prentice Hall,January 11th 2011
1941,Lehrbuch Der Programmierung Mit Java,9783932588228,367,"Klaus Echtle,Michael Goedicke",Dpunkt-Verl.,2000
1942,Software Development: Case Studies In Java,9780321117830,630,Davide Brugali,Addison Wesley Longman,March 1st 2005
1943,Object Oriented Programming Through Java,9781420047929,473,P. Radha Krishna,CRC Press,January 1st 2007
1944,Konsep dan Perancangan Database,,156,Harianto Kristanto,Penerbit Andi Yogyakarta,2000
1945,Foundations of Databases: The Logical Level,9780201537710,685,"Serge Abiteboul,Richard   Hull",Pearson,December 2nd 1994
1946,Database Management and Design,9780133088007,582,Gary W. Hansen,Prentice Hall,September 22nd 1995
1947,Beginning Databases with PostgreSQL: From Novice to Professional,689253157893,637,"Neil Matthew,Richard Stones",Apress,September 6th 2007
1948,Fundamentals of Database Management Systems,9780470624708,395,Mark L. Gillenson,John Wiley & Sons,December 6th 2011
1949,Principles Of Direct And Database Marketing,9780273683551,489,Alan Tapp,FT Press,January 1st 2005
1950,"Databases: Database, Relational Database, Relational Model, Database Management System, Database Normalization, Object-Relational",9781157460305,216,Source Wikipedia,"Books LLC, Wiki Series",June 25th 2011
1951,Beginning Visual Basic .Net Databases,9781861005557,,"Denise Gosnell,Matthew Reynolds,Bill Forgey",Wrox Press,December 23rd 2001
1952,Marketing Database Analytics: Transforming Data for Competitive Advantage,9780415657884,376,Andrew D. Banasiewicz,Routledge,May 2nd 2013
1953,Not in Database,,,Lending Library,,
1954,Information Modeling and Relational Databases: From Conceptual Analysis to Logical Design,9781558606722,761,Terry Halpin,Morgan Kaufmann Publishers,April 16th 2001
1955,"Principles of Direct, Database and Digital Marketing",9780273756507,576,Alan Tapp,Pearson/Education,October 1st 2013
1956,The Linux Database,9781558284913,456,Fred Butzen,MIS-Press,February 1st 1997
1957,"Database Systems: An Application-Oriented Approach, Introductory Version",9780321228383,688,"Michael Kifer,Philip M. Lewis,Arthur Bernstein",Pearson,March 1st 2004
1958,Oracle Database Administration for Microsoft SQL Server DBAs,9780071744317,334,Michelle Malcher,Oracle Press,September 22nd 2010
1959,Distributed Database Systems,9780890062135,528,Wesley W. Chu,Artech House Publishers,June 19th 1986
1960,Object Databases,9780201563412,304,Mary E.S. Loomis,Addison Wesley Longman,January 1st 1995
1961,Database Systems,9781558603929,874,Patrick E. O'Neil,Morgan Kaufmann Publishers,July 10th 1998
1962,"Database Systems: Design, Implementation, and Management (with Premium Web Site Printed Access Card)",9780538469685,720,"Carlos M. Coronel,Steven Morris,Peter Rob",Cengage Learning,November 20th 2009
1963,Study Guide for 1Z0-144: Oracle Database 11g: Program with PL/SQL (Oracle Certification Prep),,178,Matthew Morris,Matthew Morris,July 8th 2012
1964,Windows Azure SQL Database Programming & Design,,822,Kalman Toth,,March 2nd 2013
1965,Teradata Database Administration - The Fundamentals,9781940540160,449,"Tom Coffing,Thomas Coffing",Coffingdw,September 1st 2013
1966,Accounting Database Design,,264,Derek Liew,Derek Liew,October 28th 2010
1967,Designing XML Databases,9780130889010,655,Mark Graves,Prentice Hall PTR,October 12th 2001
1968,Practical PHP and MySQL Website Databases: A Simplified Approach,9781430260769,448,Adrian W. West,Apress,December 19th 2013
