id,title,ISBN13,pages,authors,publisher,date
2812,Advantage Database Server: The Official Guide [With CDROM],9780072230840,468,"Cary Jensen,Loy Anderson",McGraw-Hill/Osborne Media,October 29th 2003
2813,Designing Database Applications with Objects and Rules: The Idea Methodology,9780201403695,579,"Stefano Ceri,Piero Fraternali",Addison Wesley Longman,June 30th 1997
2814,Visual Basic 6 Database Programming for Dummies,9780764506253,375,Richard Mansfield,For Dummies,September 23rd 1999
2815,The Language of SQL: How to Access Data in Relational Databases,9781435457522,0,Larry Rockoff,"Course Technology, PTR",January 6th 2010
2816,Oracle Database 11g Performance Tuning Recipes,9781430236634,583,"Sam Alapati,Darl Kuhn,Bill Padfield",Apress,January 1st 2011
2817,"Temporal Databases: Theory, Design, and Implementation",9780805324136,633,"Abdullah Uz Tansel,James Clifford",Benjamin-Cummings Publishing Company,November 19th 2009
2818,Professional IOS Database Application Programming,9781118391853,384,Patrick Alessi,Wrox Press,April 11th 2013
2819,Oracle Database 10g Linux Administration,9783446228047,,Edward Wahlen,,
2820,Database Transaction Models For Advanced Applications,9781558602144,611,Ahmed K. Elmagarmid,Morgan Kaufmann Publishers,April 15th 1992
2821,Database Publishing with FileMaker Pro on the Web,9780201696653,419,Maria Langer,Addison Wesley Longman,January 1st 1998
2822,Introduction to Database Management (Project Manual),9780470114100,302,Frank  Miller,John Wiley & Sons,March 1st 2007
2823,Building Database Driven Flash Applications,9781590591109,440,Noel Jerke,Apress,October 8th 2003
2824,Databases with Access (Learning Made Simple),9780750681865,126,Moira Stephen,Routledge,September 1st 2006
2825,"Database Management: Concepts, Design And Practice",9780131998780,560,Esen A. Ozkarahan,Prentice-Hall International,1990
2826,Beginning ASP.NET Databases using C#,9788173664786,400,"John Kauffman,Kent Tegel,Brian Matsik,Jan Narkewicz,Fabio Claudio Ferracchiati,Jesudas Chinnathampi,Eric Mintz,Donald Xie,John West",,June 30th 2002
2827,High Performance Relational Database Design,9780130301987,266,John Kirkwood,Ellis Horwood,January 1st 1992
2828,SQL Tricks (Advanced Database Programming),9781937842321,120,Chris Fehily,Questing Vole Press,August 6th 2014
2829,Conceptual Schema and Relational Database Design,9780133557022,547,"Terry Halpin,G.M. Nijssen",Prentice Hall,May 31st 1995
2830,Database Projects In Access: For Advanced Level,9780340812013,311,Julian Mott,Hodder &amp Stoughton,2003
2831,"Database Systems: Concepts, Design & Applications",9788177585674,867,S.K. Singh,Prentice Hall,May 1st 2009
2832,Pro Odp.Net For Oracle Database 11g,9781430228202,445,Edmund Zehoo,Apress,April 19th 2010
2833,The Set Model for Database and Information Systems,9780201593792,228,Mikhail M. Gilula,Association for Computing Machinery (ACM),July 1st 1994
2834,Models and Languages of Object-Oriented Databases,9780201624311,218,"Georg Lausen,Gottfried Vossen",Addison Wesley Longman,January 1st 1998
2835,Web Database Applications with PHP & MySQL,9780596100032,55,"Nadine Shillingford,O'Reilly Media",O'Reilly Media,October 1st 2006
2836,Information Systems Development: A Database Approach,9780632030286,320,David E. Avison,Blackwell Science,January 1st 1992
2837,Expert Consolidation in Oracle Database 12c,9781430244288,488,Martin Bach,Apress,November 26th 2013
2838,Nearest Neighbor Search: A Database Perspective,9780387229638,170,Apostolos N. Papadopoulos,Springer,November 19th 2004
2839,Expert Oracle Practices: Oracle Database Administration from the Oak Table,9781430226680,561,"Melanie Caffrey,Pete Finnigan,Charles Hooper,Jonathan Lewis,Arup Nanda,Tim Gorman,Alex Gorbachev,Niall Litchfield,Michael Müller,Karen Morton,Tanel Põder,Robyn Sands,Jože Senegačnik,Riyaj Shamsudeen,Kurt Van Meerbeck",Apress,February 1st 2010
2840,"Databases for Small Business: Essentials of Database Management, Data Analysis, and Staff Training for Entrepreneurs and Professionals",9781484202784,318,Anna Manning,Apress,November 19th 2015
2841,Roger Jennings Database Developer's Guide with Visual Basic 6 [With Features Source Code & Demonstration Databases...],9780672310638,1172,"Roger Jennings,Matthew Harris",Sams,January 1st 1999
2842,"Database Design, Application Development, and Administration, 5th Edition",9780983332404,794,Mannino Michael,Chicago Business Press,February 9th 2011
2843,Beginning VB 2005 Databases: From Novice to Professional,9781590598108,492,"James Huddleston,Syed Fahad Gilani",Apress,March 1st 2007
2844,MySQL Cookbook: Solutions for Database Developers and Administrators,,866,Paul DuBois,O'Reilly Media,July 28th 2014
2845,"Server Side Flash Scripts, Databases, And Dynamic Development",9780764535987,,William B. Sanders,Wiley Publishing,
2846,Beginning ASP.Net 2.0 Databases: Beta Preview,9780764570810,404,"John Kauffman,Thiru Thangarathinam",Wiley Publishing,March 1st 2005
2847,Seri Aplikasi Pemrograman: Database Menggunakan Delphi,9789792024227,244,Inge Martina,Elex Media Komputindo,2001
2848,Beginning C# Databases: From Novice to Professional,9781590594339,648,"James Huddleston,Scott Allen,Ranga Raghuram",Apress,November 19th 2004
2849,Pro Oracle Spatial for Oracle Database 11g,9781590598993,787,"Ravikanth V. Kothuri,Euro Beinat,Albert Godfrind",Apress,October 1st 2007
2850,Oracle Database AJAX & PHP Web Application Development,9780071502771,458,"Lee Barney,Michael McLaughlin",McGraw-Hill/Osborne Media,February 1st 2008
2851,Oracle Database Performance and Scalability: A Quantitative Approach,9781118056998,728,Henry H. Liu,"John Wiley & Sons, Inc",December 2011
2852,Modeling and Designing Accounting Systems: Using Access to Build a Database,9780471450870,149,Laura R. Ingraham,Wiley,December 1st 2005
2853,"Teradata Database Design Giving Detailed Data Flight, First Edition",9780970498052,,Tom Coffing,,
2854,Study Guide for 1Z0-051: Oracle Database 11g: SQL Fundamentals I,9781475204667,144,Matthew Morris,CreateSpace Independent Publishing Platform,April 16th 2012
2855,Oracle Database 11g Performance Tuning Recipes: A Problem-Solution Approach,9781430236627,592,"Sam Alapati,Darl Kuhn,Bill Padfield",Apress,August 23rd 2011
2856,OCP: Oracle Database 11g Administrator Certified Professional Certification Kit,9780470395141,2040,"Biju Thomas,Robert G. Freeman,Charles A. Pack,Doug Stuns",John Wiley & Sons,April 17th 2009
2857,"DB2 9.7 for Linux, UNIX, and Windows Database Administration: Certification Study Notes",9781583473672,160,Roger E. Sanders,Mc Press,November 2nd 2011
2858,Advances in Knowledge Discovery in Databases,9783319132112,370,"Animesh Adhikari,Jhimli Adhikari",Springer,February 14th 2015
2859,Fundamentals of Database Systems,9781299958814,1088,Ramez Elmasri,Pearson,October 8th 2013
2860,Oracle Database 12c Security,9780071824286,552,"David C. Knox,William Maroulis,Scott Gaetjen",McGraw-Hill Education,January 5th 2015
2861,Fuzzy Database Modeling,9783790811711,234,"Adnan Yazici,R. George",Physica-Verlag,January 22nd 1999
2862,Recovery Mechanisms in Database Systems,9780136142157,898,"Vijay Kumar,Meichun Hsu",Prentice Hall,January 1st 1998
2863,GPS / Database ANDROID Programming,,178,Christos Karayiannis,,January 12th 2014
2864,Introduction to Database Systems,,580,ITL Education Solutions Limited,Pearson,June 22nd 2010
2865,Van Bodemvondst tot Database,9789053453186,176,"Hupperetz, Wim",Matrijs,2010
2866,The Teradata Database:  Introduction And Sql,9780966549300,,Brian R. Marshall,,
2867,Oracle Software: Oracle Database,9781156553961,370,Books LLC,General Books LLC,August 31st 2011
2868,Knowledge Discovery in Databases,9780262660709,539,"Gregory Piateski,Gregory Piateski",AAAI Press,December 30th 1991
2869,Beginning Android Database Development,9781430262329,400,Praveen Chaturvedi,Apress,February 12th 2014
2870,Food Properties Database,9780849307645,12,R. Paul Singh,CRC Press,September 15th 1993
2871,"Data Structures, Files and Databases",9780333436905,256,"Carl Bamford,Paul J. Curran",Scholium International,December 1st 1987
2872,Database Programming Using R,,90,Agus Kurniawan,PE Press,December 27th 2014
2873,Database: Technology and Management,9780471887379,352,Robert C. Goldstein,Wiley,January 18th 1985
2874,Creating Cool Web Databases,9780764530197,469,"Joseph T. Sinclair,Carol McCullough-Dieter",John Wiley & Sons Inc (Computers),October 9th 1996
2875,ECDL Advanced Databases,9780131202405,320,Paul Holden,Prentice Hall,February 12th 2004
2876,"Databases: Design, Development & Deployment",9780071215060,552,Peter Rob,McGraw-Hill Companies,January 1st 2004
2877,Practical Database Management,9780534925925,498,Tony Fabbri,PWS Pub. Co.,January 1st 1992
2878,Distributed and Multi-Database Systems,9780553091564,477,Angelo R. Bobak,Bantam Books,April 1st 1993
2879,Database Design and Application Development,9780070530515,,Peter Rob,McGraw-Hill Companies,January 1st 1995
2880,Component Database Systems,9780080490724,313,"Klaus R Dittrich,Andreas Geppert",Morgan Kaufmann Publishers,May 14th 2014
2881,Python Programming with Oracle Database,9781608300136,176,Ray Terrill,Champion Writers,August 1st 2009
2882,Accuracy of Spatial Databases,9780203490235,207,M.F. Goodchild,CRC Press,December 6th 1989
2883,Relational Database Systems,9780444877185,451,Claude Delobel,North-Holland,
2884,Database Systems Engineering,9780198596721,448,R. P. Whittington,"Oxford University Press, USA",December 1st 1988
2885,Pro IOS Database Development,9781430236290,375,Marc Hoffman,Apress,August 14th 2013
2886,Databases: Organizing Information,9781435894266,48,Greg Roza,Rosen Central,August 15th 2010
2887,Introducing Relational Database,9780850123975,188,Alan J. Mayne,NCC Publications,1983
2888,Readings in Artificial Intelligence and Databases,9780080886626,688,"John Mylopoulos,Michael L. Brodie",Morgan Kaufmann Publishers,September 1st 1988
2889,Database Performance,9780080285894,341,D. Bell,Pergamon,
2890,Building Databases,,168,F. Mark Schiavone,Sycamore Technical Press,June 8th 2013
2891,DNA Databases,9780737736007,100,Lauri R Harding,Greenhaven Press,August 1st 2007
2892,The Collaborative Database,9780730005155,,Chris Bigum,Hyperion Books,
2893,Starting Database Administration: Oracle DBA,,,Oraclesql-plsql,Smashwords Edition,June 1st 2014
2894,Filters and Membranes for Hemodialysis Database 2000:,9783805570626,,Claudio Ronco,S. Karger AG (Switzerland),August 1st 2000
2895,"Advanced Topics in Database Research, Volume 3",9781591402558,370,"Keng Siau,Keng Siau",Idea Group Publishing,July 1st 2003
2896,XML Data Management: Native XML and XML-Enabled Database Systems,9780201844528,688,"Akmal B. Chaudhri,Roberto Zicari",Addison-Wesley Professional,March 22nd 2003
2897,Study Guide for 1Z0-047: Oracle Database SQL Expert (Oracle Certification Prep),,151,Matthew Morris,Matthew Morris,April 5th 2012
2898,Database Annotation in Molecular Biology: Principles and Practice,9780470856819,266,Arthur M. Lesk,Wiley,January 1st 2005
2899,Student Lecture Companion: A Note-Taking Guide : Databases Illuminated,9780763726928,156,Catherine M. Ricardo,Jones & Bartlett Pub,August 30th 2004
2900,"The Software Catalog: Microcomputers, Winter 1985 Complete Catalog",9780444008831,1700,International Software Database,Elsevier Science & Technology,
2901,How to Build a Million Dollar Database,,148,Michelle Bergquist,Pink Tomato Publishing,August 15th 2008
2902,Visual Basic Database Programming [With CDROM],9780201721935,448,Michael Kofler,Addison-Wesley Professional,November 2nd 2001
2903,Nearest Neighbor Search: : A Database Perspective,9781280700385,170,"Yannis Manolopoulos,Apostolos N Papadopoulos",Springer,January 10th 2010
2904,Flexible Databases Supporting Imprecision And Uncertainty,9783540332886,,Gloria Bordogna,Springer,June 16th 2006
2905,Relational Database Systems: Analysis And Comparison,9780387120324,618,Joachim Schmidt,Springer,
2906,Maxdata: A Time Series Database System,9783540522096,151,Wilhelm A. Hennerkes,Springer,February 9th 1990
2907,Beginning ASP.Net Databases Using C#,9781861007414,480,"Jesudas Chinnathampi,Erix Mintz,John West,James Greenwood,Donald Xie,Brian Matsik,Jan D. Narkiewicz,Matt Butler,Kent Tegels,Jan Narkewicz,Fabio Claudio Ferrachiati,Eric Mintz,Fabio Ferracchiati",Wrox Press,July 28th 2002
2908,"Biodiversity Databases: Techniques, Politics, and Applications",9780415332903,193,"Gordon B. Curry,Gordon B. Curry",CRC Press,April 25th 2007
2909,Managing Database: Four Critical Factors,9780894351037,,Michael M. Gorman,,
2910,Massively Parallel Databases and Mapreduce Systems,9781601987501,120,"Shivnath Babu,Herodotos Herodotou",Now Publishers,November 13th 2013
2911,Machine Learning and Knowledge Discovery in Databases,9783642158841,542,"José L. Balcázar,Francesco Bonchi,Aristides Gionis",Springer,March 13th 2011
2912,PostgreSQL Database Administration: Basic concepts,,175,Federico Campoli,,January 3rd 2015
2913,Solutions Manual for Database Development and Management:,9780849392382,,Chao Lee,Auerbach Publications,
2914,Building Database Driven Web Catalogs,9780072127898,300,Sherif Danish,McGraw-Hill Education,May 22nd 1998
2915,Web Database Development For Windows Platforms,9780130139856,475,Dan D. Gutierrez,Prentice Hall,January 1st 2000
2916,Using Adsm To Back Up Databases,9780738400341,,IBM Redbooks,,
2917,Multimedia Database Retrieval: A Humancentered Approach,9780387346298,186,"Ling Guan,Paisarn Muneesawang",Springer Science+Business Media,January 1st 2006
2918,Handbook of Carcinogenic Potency and Genotoxicity Databases,9780849326844,768,Lois Swirsky Gold,CRC Press,November 26th 1996
2919,Custom: Database Design & Development Simplified,9781111031480,280,Marselis,Cengage Learning,July 13th 2009
2920,National Forensic DNA Database in the EU,,111,"Nathan Van Camp,Kris Dierickx","Center for Biomedical Ethics and Law, Catholic University",2007
2921,"Researcher's Guide to the USRDS Database, 1998",,,USRDS,,1998
2922,Teradata Database Administration Tasm and Viewpoint,9781306330015,262,"Tom Coffing,Carling Nolan",Coffing Publishing,January 1st 2013
2923,"Researcher's Guide to the USRDS Database, 1999",,,USRDS,,1999
2924,Database Machines: Modern Trends and Applications,9783540171645,570,"A.K. Sood,A.H. Qureshi",Springer,December 1st 1986
2925,Database Systems: An Application Oriented Approach,9780321312563,,"Arthur J. Bernstein,Philip M. Lewis,Arthur Bernstein",,
2926,Gale Directory of Databases: 2 Volumes,9780787622961,2800,Gale Cengage Learning,Gale Cengage,September 1st 1998
2927,Introduction to Database Management: A Practical Approach,9780697004512,532,Gerry Litton,William C. Brown,January 1st 1987
2928,Community Built Databases: Research And Development,9783642190469,375,Eric Pardede,Springer,May 21st 2011
2929,Standard Relational and Network Database Languages,9781447132899,148,"Emmanuel J. Yannakoudakis,C.P. Cheng",Springer,February 3rd 2012
2930,Natural Medicines Comprehensive Database 2010,9780978820572,,Letter Pharmacist's,Pharmacist's Letter,January 1st 2010
2931,"Database Management: Concepts, Design, and Practice",9780134681252,560,Esen Ozkarahan,Prentice Hall,December 1st 1989
2932,Professional iOS Database Application Programming,,384,Patrick Alessi,Wrox,April 10th 2013
2933,Design of an Object-Oriented Database Language,,,Bruce Conrad,Bruce Conrad,November 24th 2009
2934,Database Security XII: Status and Prospects,9780792384885,296,Sushil Jajodia,Springer,April 30th 1999
2935,Agile Practices for Oracle Database Development,9780321769787,300,Pramodkumar J. Sadalage,Addison-Wesley Professional,April 1st 2016
2936,Oracle Performance Tuning for Database Administrat,9780596003548,,"Peter Corrigan,Mark Gurry",O'Reilly Media,January 2001
2937,Database Management for Microcomputers: Design and Implementation,9780030315886,378,Jan L. Harrington,Harcourt Brace College Publishers,November 1st 1997
2938,Database Design And Management: An Applied Approach,9780071009348,,"David Stamper,Wilson Price",,
2939,Management of Heterogeneous and Autonomous Database Systems,9781558602168,432,"Ahmed Elmagarmid,Ahmed Elmagarmid",Morgan Kaufmann Publishers,October 27th 1998
2940,iPhone Database Programming Exercises: SQLite,,47,Norman McEntire,Servin Corporation,March 1st 2010
2941,Effective Databases For Text & Document Management,9781931777636,371,Shirley A. Becker,IRM Press,January 1st 2000
2942,Fuzzy Preference Queries to Relational Databases,9781848168695,330,"Olivier Pivert,Patrick Bosc",Imperial College Press,February 24th 2012
2943,The Nested Universal Relation Database Model,9783540554936,177,Mark Levene,Springer,June 1st 1992
2944,Advances in Database Systems: Implementations and Applications,9783211826140,377,"Jan Paredaens,Lev Tenenbaum",Springer,November 2nd 1994
2945,Database-Driven Web Sites [With DVD],9780619064488,828,"Mike Morrison,Michael Morrison",Course Technology,November 1st 2002
2946,SQL Short Course (Database Programming),9781937842338,270,Chris Fehily,Questing Vole Press,September 8th 2014
2947,Database Practitioner's Guide to Useable Mathematics,9781466567566,400,Joe Celko,CRC Press,February 15th 2016
2948,Cesmm3 Price Database 1999/2000,9780727727794,600,E.C. Harris,Thomas Telford,January 1st 1999
2949,"Database Computers: Principles, Architectures, And Techniques",9780070622951,511,Stanley Su,McGraw-Hill Companies,January 1st 1988
2950,Database: Ecdl - The European PC Standard,9781852334468,118,Bill McTaggart,Springer,January 1st 2001
2951,Cold Fusion4: Web Database Programming,9789799597618,141,Gregorius Agung,Jubilee Solusi Enterprise,2000
2952,Distributed Multimedia Databases: Techniques and Applications,9781591400189,384,Timothy K. Shih,IGI Publishing,July 1st 2001
2953,"Food Properties: Database 2.0, Windows",9780849307652,12,R. Paul Singh,CRC Press,April 18th 1995
2954,Machine Learning and Knowledge Discovery in Databases,9786613567109,648,"José L. Balcázar,Francesco Bonchi,Aristides Gionis,Sebag Michle",Springer,September 13th 2010
2955,Lectures on SQL and Relational Database Design,9781480191822,176,John W Starner,Createspace,November 7th 2012
2956,Natural Medicines: Comprehensive Database 2013,9780978820596,2323,Pharmacist's Letter,Therapeutic Research Faculty,May 1st 2012
2957,RMAN Recipes for Oracle Database 11g,9781430203056,0,Darl Kuhn,Apress L. P.,August 30th 2007
2958,Db2 Universal Database Certification Guide,9780130796615,,Dwaine Snow,,
2959,Database systemen voor de praktijk,,661,J.A. Vandenbulcke,SDU Uitgevers,2005
2960,Database Systems and Applications: Mathematical Applications,9781496086266,168,V. Vasu,Createspace,February 26th 2014
2961,Scaleable Object-Oriented Database Design,9780134903767,,Peter M. Heinckiens,Prentice Hall,
2962,C++ Database Applications with the Paradox Engine,9780830643271,325,"Thomas   Finn,Robert Signore",McGraw-Hill Companies,August 1st 1993
2963,AS/400 Architecture and Application: The Database Machine,9780894354342,300,Jill T. Lawrence,QED Information Sciences,November 15th 1992
2964,The Problem of Incomplete Information in Relational Databases,9780387549194,156,G. Grahne,Springer,November 1st 1991
2965,Database And File Management Systems For The Microcomputer,9780673180889,122,Nelson T. Dinerstein,Pearson Scott Foresman,
2966,Database Decisions: Briefings On The Management Of Technology,9780273602897,,Bart O'Brien,Trans-Atlantic Publications,
2967,Your First Guide to Database Design,,243,Andrew Comeau,Andrew Comeau,October 4th 2013
2968,Databases - Role and Structure: An Advanced Course,9780521254304,406,"P. M. Stocker,P. M. Stocker",Cambridge University Press,July 26th 1984
2969,SAP Database Administration with IBM DB2,9781592294497,,Andrae Faustmann,Galileo Press,March 1st 2013
2970,Concepts of Database Management Systems (Bca),9781322128542,259,Shefali Naik,Pearson India,January 1st 2014
2971,Intelligent Multimedia Databases and Information Retrieval,9781613501276,,"Li Yan,Zongmin Ma",Information Science Reference,September 30th 2011
2972,Physical Database Design Using Oracle,9780203506233,264,Burleson K.,Taylor & Francis Group,June 1st 2004
2973,The Legal Protection of Databases: A Comparative Analysis,9781281779724,362,E. Derclaye,Edward Elgar Publishing,November 14th 2008
2974,Unix (TM) Relational Database Management,9780139386220,,Rod Manis,Prentice Hall,March 17th 1988
2975,"Database Systems: Concepts, Management, and Applications",9780155000292,736,"Alden C. Lorents,Lorents, Alden / Morgan, James Lorents, Alden / Morgan, James",Dryden Press,November 1st 1997
2976,Computing For Site Managers: Database Techniques,9780632039685,224,Robin Flowers,Wiley-Blackwell,June 13th 1996
2977,Client/Server Databases: Enterprise Computing,9780133051605,368,"James      Martin,Joseph Leben",Prentice Hall,July 7th 1995
2978,Algebraic Structures in Automata and Database Theory,9789810209360,296,B.I. Plotkin,World Scientific Publishing Company,December 1st 1992
2979,"Relational Databases: Concepts, Design, and Administration",9780070072527,294,Kenmore S. Brathwaite,McGraw-Hill Companies,June 1st 1991
2980,Contemporary Database Marketing: Concepts and Applications,9781933199443,360,"Lisa D. Spiller,Kurtis D. Ruf",Racom Communications,August 30th 2013
2981,Managing Reference Data in Enterprise Databases,9780080510941,387,Malcolm Chisholm,Morgan Kaufmann Publishers,August 1st 2000
2982,Visual Basic 4 Database How to,9781878739940,835,"Stuart Bloom,Don Kiely",Waite Group Press,October 1st 1995
2983,Semantic Database Systems: A Functional Introduction,9780863113468,167,C.S. Prabhu,Vantage Press,September 1st 1993
2984,Wie Data Management: Databases and Organizations,9780471428510,,Richard T. Watson,John Wiley & Sons,
2985,Image Databases And Multi Media Search,9789810233273,328,"Ramesh Jain,Arnoldus Wilhelmus Maria Smeulders,Arnold Smeulders",World Scientific Publishing Company,January 23rd 1998
2986,Learn Database Systems with Implementation and Examples,9781291688894,180,Imed Bouchrika,Lulu.com,January 3rd 2014
2987,Natural Medicines Comprehensive Database 2009,9780978820558,2323,"Letter Pharmacist's,Letter Pharmacist's",Therapeutic Research Faculty,May 1st 2009
2988,A Practical Guide to Relational Database Design,9780952604303,182,"Peter Domanski,Philip Irvine",Domanski-Irvine Books,August 1995
2989,Analysis and Comparison of Relational Database Systems,9780201199406,280,Patrick Valduriez,Addison Wesley Publishing Company,September 1st 1988
2990,Beginning Oracle Database 11g Administration,9781430206286,430,William Barker,Apress,October 27th 2013
2991,Query Processing for Advanced Database Systems,9780080515595,512,"Johann Christoph Freytag,David Maier,Gottfried Vossen",Morgan Kaufmann Publishers,August 1st 1993
2992,Trends In Database Design And Customer Services,9780942308273,,Wendy Schipper,,
2993,Database Processing with Fourth Generation Languages,9780538106207,312,Gary W. Hansen,Thomson South-Western,November 1st 1988
2994,Managing Time in Databases: A Comprehensive Approach,9780080963372,502,"Tom Johnston,Randall Weis",Morgan Kaufmann Publishers,May 14th 2014
2995,Instant Oracle Database and Powershell How-To,9781849688598,80,Geoffrey Hudik,Packt Publishing,January 25th 2013
2996,Oracle Database 10g DBA Handbook,9780071770439,736,"Kevin Loney,Bob Bryla",McGraw-Hill Education,April 14th 2005
2997,The Complete Business Traveler's Guide,9780942651003,,American Database Corporation,American Database Corporation,
2998,Using Informix Data Blades,9780789714183,,Database Consulting Group,Que,October 1st 1997
2999,No Special Skills,,168,Ms. E's Database,AuthorHouse,November 9th 2011
3000,Collins Britain Compact Road Atlas 2009,,278,Collins Bartholomew Digital Database,Collins,
3001,The Software Catalog: Microcomputers & Minicomputers,9780444007759,,International Software Database,Elsevier Science & Technology,
3002,The Software Catalog: Science & Engineering,9780444010582,612,International Software Database,Elsevier Science & Technology,
3003,The Twelfth Virgin Film Guide,,964,"""TV Guide Movie Database""",Virgin Books,September 9th 2004
3004,The Complete International Traveler's Guide,9780942651010,,"American Database Corporation,William A. Benjamin",American Database Corporation,
3005,"Proceedings: Pecora Thirteen: Human Interactions with the Environment: Perspectives from Space: [Proceedings], August 20-22, 1996, Ramkota Inn, Sioux Falls, South Dakota",9781570830556,,Global Resource Information Database,American Society for Photogrammetry & Remote Sensing,January 1st 1998
3006,The Thirteenth Virgin Film Guide,,896,"""TV Guide Movie Database""",Virgin Books,September 8th 2005
3007,Dir of CA Wholesalers and Service,9781575410869,,Database Publishing Company,Database Publishing Company,January 1st 1999
3008,"PHP & MySQL: Your Visual Blueprint for Creating Dynamic, Database-Driven Web Sites",9780470048399,307,Janet Valade,Visual,September 1st 2006
3009,"Oracle Database 11g Oracle Real Application Clusters Handbook, 2nd Edition (Oracle Press)",,544,K. Gopalakrishnan,McGraw-Hill Osborne Media,August 10th 2011
3010,"Children's Literature: An Invitation to the World (with Children's Literature Database CD-ROM, Version 2.0)",9780321049155,464,Diana Mitchell,Allyn & Bacon,November 8th 2002
3011,"Oracle Database 10g XML & SQL: Design, Build, & Manage XML Applications in Java, C, C++, & PL/SQL",9780072229523,572,"Mark Scardina,Ben Chang,Jinyu Wang",McGraw-Hill/Osborne Media,July 19th 2004
3012,Data Modeling for Mongodb: Building Well-Designed and Supportable Mongodb Databases,9781935504702,211,Steve Hoberman,"Technics Publications, LLC",June 10th 2014
3013,The Best Boring Book Ever of Select Healthcare Classification Systems and Databases,9780615909769,170,"Katherine S. Rowell,Ann Cutrell",Healthdataviz,November 19th 2013
3014,Ocp Oracle9i Database: Fundamentals I Exam Guide [With CD-ROM],9780072195408,561,"Jason Couchman,Sudheer Marisetti",McGraw-Hill/Osborne Media,January 14th 2002
