id,title,ISBN13,pages,authors,publisher,date
890,Java and Flex Integration Bible,9780470400746,530,"Matthew Keefe,Charles A. Christiansen",John Wiley & Sons,March 1st 2009
891,Pro Java Programming,9781590594742,720,Brett Spell,Apress,June 1st 2005
892,Java Programming Basics,9781558284692,458,"Edith Au,Mark Mangan,Dave Makower,Pencom Web Works,Michael Wei,Linda DiSanto,Ellick Quach",Mis Pr,May 30th 1996
893,Micro Java Game Development,9780672323423,576,Roman Verhovsek,Addison-Wesley Professional,April 28th 2002
894,Java Language Reference,9781565923263,492,Mark Grand,O'Reilly Media,August 8th 1997
895,The Java Virtual Machine Specification,9780201634525,475,"Tim Lindholm,Frank Yellin",Addison Wesley Publishing Company,September 1st 1996
896,Java Programming: Comprehensive,9780760010709,687,Joyce M. Farrell,Course Technology,February 26th 1999
897,Java AWT Reference,9781565922402,1074,"John Zukowski,Mike Loukides",O'Reilly Media,April 8th 1997
898,Java Gui Development,9780672315466,684,Vartan Piroumian,Sams,August 25th 1999
899,Java 2 Bible,9780764508820,960,"Justin Couch,Daniel H. Steinberg",Wiley,April 15th 2002
900,Java Developer's Reference: With CDROM,9781575211299,1258,"Mike Cohn,Michael Morrison,Michael T. Nygard,Dan Joshi,Tom Trinko",Sams,October 1st 1996
901,Data Structures Using Java,9781449628086,544,Duncan A Buell,Jones & Bartlett Publishers,January 1st 2012
902,Java Servlets Developer's Guide,9780072222623,600,"Karl Moss,Michael Mueller,Lyssa Wald",McGraw-Hill/Osborne Media,February 21st 2002
903,Java Seriets Jsp,9788176565813,,Yashavant Kanetkar,,
904,House of Java: Vol. 2,9781561633296,96,Marcus Murphy,NBM Publishing,June 1st 2001
905,Java: An Eventful Approach,9780131424159,720,Kim Bruce,Pearson,August 8th 2005
906,Programming Finite Elements In Java,9781848829718,402,Gennadiy P. Nikishkov,Springer,January 1st 2010
907,Sprechen Sie Java?,9783898645959,348,Hanspeter Mössenböck,dpunkt Verlag,June 20th 2011
908,Java(tm) Native Interface: Programmer's Guide and Specification,9780201325775,320,Sheng Liang,Addison-Wesley Professional,June 20th 1999
909,Java 2 for Professional Developers,9780672316975,762,Mike  Morgan,Sams,July 1st 1999
910,Java in Plain English,9781558285637,704,Brian Overland,Wiley,October 14th 1997
911,Java Programming Guide for Beginners,,34,Programming and Tech League,,December 31st 2014
912,Java Application Development on Linux,9780131436978,567,"Carl Albing,Michael Schwarz",Prentice Hall PTR,October 1st 2004
913,Java Security Handbook,9780672316029,552,"Jamie Jaworski,Paul Perrone",Sams,September 21st 2000
914,Como Programar En Java,9789701700440,0,Harvey M. Deitel,Prentice Hall,December 28th 1997
915,Java Persistence with Jpa,9781432755850,390,Daoqi Yang,Outskirts Press,March 31st 2010
916,"The Domestication of Desire: Women, Wealth, and Modernity in Java",9780691016924,320,Suzanne April Brenner,Princeton University Press,July 21st 1998
917,"The Java Virtual Machine Specification, Java SE 7 Edition",9780133260441,608,"Tim Lindholm,Frank Yellin,Gilad Bracha,Alex Buckley",Prentice Hall,January 4th 2013
918,"The Java Virtual Machine Specification, Java Se 8 Edition",9780133922721,600,"Tim Lindholm,Frank Yellin,Gilad Bracha",Addison-Wesley Professional,May 3rd 2014
919,"Weaving a Website: Programming in HTML, Java Script, Perl and Java",9780130282200,747,Susan Anderson-Freed,Prentice Hall,August 6th 2001
920,Java Ee 7 Recipes: A Problem-Solution Approach,9781430244257,748,Josh Juneau,Apress,May 21st 2013
921,"Beginning JSP, Jsf and Tomcat: Java Web Development",9781430246237,436,Giulio Zambon,Apress,October 1st 2012
922,Ocejwcd Study Companion: Certified Expert Java Ee 6 Web Component Developer (Oracle Exam 1z0-899),9780955160349,682,Charles Lyons,Garner Press,August 15th 2012
923,Starting Out with Java: From Control Structures Through Objects [With CDROM],9780321479273,987,Tony Gaddis,Addison Wesley Publishing Company,January 27th 2007
924,Great Ideas in Computer Science with Java,9780262024976,563,Alan W. Biermann,Mit Press,November 9th 2001
925,Tantric Temples: Eros and Magic in Java,9780892541690,367,Peter Levenda,Ibis Press,November 1st 2011
926,Concurrent and Real-Time Programming in Java,9780470844373,446,Andrew Wellings,Wiley,November 1st 2004
927,Mastering Java 1.2 [With Packed with Java Tools & Utilities],9780782121803,1200,John Zukowski,Sybex,August 1st 1998
928,Harnessing Java 7 (A Comprehensive Approach to Learning Java),,619,Kishori Sharan,Amazon,January 14th 2012
929,"Wicked Cool Java: Code Bits, Open-Source Libraries, and Project Ideas",9781593270612,304,Brian D. Eubanks,No Starch Press,November 25th 2005
930,Learn to Program with Minecraft Plugins: Create Flying Creepers and Flaming Cows in Java,9781937785789,200,Andy Hunt,The Pragmatic Bookshelf,March 3rd 2014
931,The Cucumber for Java Book: Behaviour-Driven Development for Testers and Developers,9781941222294,338,"Seb Rose,Matt Wynne,Aslak Hellesoy",Pragmatic Bookshelf,February 16th 2015
932,Java: Easy and step by step JAVA Html progamming for beginners,,38,S. J. Cole,,November 30th 2014
933,Oca Java Se 7 Programmer I Study Guide (Exam 1z0-803),9780071789448,576,"Robert Liguori,Edward Finegan",McGraw-Hill Education,September 22nd 2012
934,Sun Certified Programmer & Developer for Java 2 Study Guide (Exam 310-035 & 310-027),783254041233,752,"Kathy Sierra,Bert Bates",McGraw-Hill Osborne Media,December 11th 2002
935,Java,9780333791851,,Colin McCormack,,
936,Java,9780135101230,295,"Insight Guides,Peter Hutton",Prentice Hall,May 1st 1983
937,Inside Indonesian Society: Cultural Change in Java,9789054960263,240,Niels Mulder,The Pepin Press,September 15th 1997
938,Pro Java EE 5 Performance Management and Optimization,9781590596104,397,Steven Haines,Apress,April 1st 2006
939,"Graphic Java 2, Volume 1, AWT",9780130796660,,David M. Geary,Prentice Hall PTR,January 1st 1998
940,Programming with Java,,480,E. Balagurusamy,McGraw Hill Education (India) Private Limited,July 30th 2014
941,Java Essay,,342,Masatoshi Iguchi,Troubador Publishing Ltd,January 28th 2015
942,کلید Java,,96,"علی قنبری سرخی,رضا خلیلی",کلید آموزش,
943,Java Performance,,717,"Hunt Charlie,John Binu",Addison-Wesley Professional,October 4th 2011
944,Object-Oriented Software Engineering: Practical Software Development Using UML and Java,9780072834956,497,"Timothy Lethbridge,Robert Laganiere",McGraw-Hill Science/Engineering/Math,May 16th 2002
945,Orchids of Java,9789995175900,,J.B. Comber,American Orchid Society,December 1st 1990
946,Java by Dissection,9780201725964,509,"Ira Pohl,Charlie McDowell",Addison Wesley Publishing Company,December 15th 2000
947,Java 1.1,9780078824364,1028,"Patrick Naughton,Herbert Schildt",Osborne Publishing,November 28th 1997
948,Instant Messaging in Java: The Jabber Protocols,9781930110465,402,"Iain Shiegoka,Iain Shiegoka",Manning Publications,April 1st 2002
949,Java 1.1 Certification Study Guide [With *],9780782120691,720,"Simon Roberts,Philip Heller",Sybex,September 1st 1997
950,"Scripting in Java: Languages, Frameworks, and Patterns",9780321321930,528,Dejan Bosanac,Addison-Wesley Professional,August 1st 2007
951,Professional Java Development with the Spring Framework,9780471748946,676,"Rod Johnson,Thomas Risberg,Colin Sampaleanu,Jürgen Höller,Alef Arendsen",Wrox Press,September 26th 2005
952,Web Services Patterns: Java Edition,9781590590843,352,Paul B. Monday,Apress,April 8th 2003
953,Programming with Java: A Multimedia Approach [With CDROM],9781449638610,698,Radhika S Grover,Jones & Bartlett Publishers,October 20th 2011
954,Java Coding Guidelines: 75 Recommendations for Reliable and Secure Programs,9780321933157,304,"Fred Long,Dhruv Mohindra,Robert C. Seacord,Dean F. Sutherland,David Svoboda",Addison-Wesley Professional,September 9th 2013
955,"Java Practice Questions: Oracle Certified Professional, Java SE 7 Programmer (OCPJP)",9781484884744,356,Esteban Herrera,CreateSpace Independent Publishing Platform,June 4th 2013
956,"Opium to Java: Revenue Farming and Chinese Enterprise in Colonial Indonesia, 1860-1910",9789793780498,296,James R. Rush,Equinox Publishing (Indonesia),January 31st 2007
957,Data Structures and Algorithms Made Easy in Java: Data Structure and Algorithmic Puzzles,,420,Narasimha Karumanchi,CreateSpace Independent Publishing Platform,September 14th 2011
958,"JAVA: JAVA for Beginners - The Quick and Simple Way to Learn JAVA - Programming Language for JAVA: JAVASCRIPT: Java Programming (Web Site Design, Programming ... and Technology, HTML 5, JAVA Book 1)",,67,"David Lawfield,Javascript Programming",,April 30th 2015
959,C# for Java Programmers,9781931836548,608,"Harold Cabrera,Jeremy Faircloth,Stephen Goldberg",Syngress Publishing,August 9th 2002
960,Developing Mainframe Java Applications,9780471415282,464,Lou Marco,John Wiley & Sons,August 1st 2001
961,Java: The Complete Reference,9780078822315,886,"Patrick Naughton,Herbert Schildt",Osborne Publishing,December 1st 1996
962,Rescued By Java (Rescued By Series),9781884133657,,Kris Jamsa,,
963,Java Persistence for Relational Databases,9781590590713,368,Richard Sperko,Apress,July 2nd 2003
964,Java Messaging (Programming Series),9781584504184,480,Eric Bruno,Cengage Learning,November 7th 2005
965,Java Ee 5,9782212123630,351,"Antonio Goncalves,Louis Dewez",Eyrolles,2008
966,The Java Web Services Tutorial,9780201768114,528,"Eric Armstrong,Maydene Fisher,Kim Haase,Dale Green,Debbie Carson",Pearson Education,March 15th 2002
967,SCJD Exam with J2SE 5 (Expert's Voice in Java),9781590595169,342,"Andrew Monkhouse,Terry Camerlengo",Apress,December 13th 2005
968,Ruby on Rails for PHP and Java Developers,9783540731443,394,Deepak Vohra,Springer,September 1st 2007
969,"Web Enabled Commercial Application Development Using Html, Java Script",9788176562744,,Ivan Bayross,,
970,Hibernate Made Easy: Simplified Data Persistence with Hibernate and Jpa (Java Persistence API) Annotations,9780615201955,442,"Cameron W. McKenzie,Kerri Sheehan",Pulpjava,April 25th 2008
971,OCAJP Oracle Certified Associate Java SE 7 Programmer Practice Exams,,2735,Hanumant Deshmukh,Enthuware,September 1st 2012
972,RESTful Java Patterns and Best Practices,,152,Bhakti Mehta,Packt Publishing,September 19th 2014
973,Learning Reactive Programming with Java 8,,184,Nickolay Tsvetinov,Packt Publishing,June 24th 2015
974,The Java? Tutorial Continued: The Rest of the JDK?,9780201485585,976,"Mary Campione,Kathy Walrath,Alison Huml",Addison-Wesley Professional,January 1st 1999
975,Professional Eclipse 3 for Java Developers,9780470020050,600,Berthold Daum,Wrox Press,November 12th 2004
976,The Complete Idiot's Guide To Java Script,9780789711366,,"Aaron Weiss,Scotty Walter",Que,
977,Manuale Di Java 7: Programmazione Orientata Agli Oggetti Con Java Standard Edition 7,9788820344771,618,Claudio De Sio Cesari,U. Hoepli,2011
978,Enterprise Java for SAP,9781590590980,320,Austin Sincock,Apress,July 25th 2003
979,Professional Java Xml,9781861004017,,"Kal Ahmed,Andrei Cioroianu",Wrox Press,April 26th 2001
980,Java Web Development Illuminated,9780763734237,702,"Kai Qian,Robert Brown",Jones & Bartlett Publishers,July 25th 2006
981,Java 2 by Example,9780789722669,544,Geoff Friesen,Que,December 1st 1999
982,Trik Pemrograman Java untuk Jaringan dan Internet,9789792017182,190,"Onno W. Purbo,Cokorda Raka Angga J.,Asfira Sagitri",Elex Media Komputindo,2000
983,Beginning Java Programming,,134,Iducate Learning Technologies,,June 13th 2012
984,"The British in Java, 1811-1816: A Javanese Account",9780197260623,672,"Peter  Carey,John Villiers","Oxford University Press, USA",April 9th 1992
985,Java Basics,9780619059675,336,"Kenneth A. Lambert,Martin Osborne",Cengage Learning,May 14th 2002
986,A Friend Of Nikki Sunshine's,9781412050364,226,Java Bomani,Trafford Publishing,
987,How Tomcat Works: A Guide to Developing Your Own Java Servlet Container,9780975212806,458,"Budi Kurniawan,Paul Deck",BrainySoftware,April 1st 2004
988,"Clojure Grundlagen, Concurrent Programming, Java",9783898646840,344,"Stefan Kamphausen,Tim Oliver Kaiser",dpunkt-Verl,2010
989,More Java Gems,9780521774772,504,Dwight Deugo,Cambridge University Press,January 28th 2000
990,Java Developers Guide: With CDROM,9781575210698,729,"Jamie Jaworski,Sams Net Development Group",Sams,July 21st 1996
991,Java Deployment with Jnlp and Webstart,9780672321825,512,Mauro Marinilli,Sams Publishing,September 29th 2001
992,Java Cryptography Extensions: Practical Guide for Programmers,9780127427515,176,Jason Weiss,Morgan Kaufmann Publishers,March 12th 2004
993,Java Entwicklung Mit Eclipse 3,9783898642811,,Berthold Daum,,
994,Professional Java XML Programming with Servlets and JSP,9781861002853,772,"Sasha Nakhimovksy,Tom Myers,Sasha Nakhimovksy",Wrox Press,December 1st 1999
995,"Java Masterclass: Java Exceptions, Assertions and Logging",9780957410541,162,Sam Alapati,P8tech,October 11th 2013
996,Beginning Java EE 6 with GlassFish 3 (Expert's Voice in Java Technology),,536,Antonio Goncalves,Apress,August 24th 2010
997,JAVA 2 Programmazione avanzata,9788883010644,160,Carlo Pelliccia,Edizioni Master,April 1st 2003
998,Java Reference Library on the Web,9781565923591,4,"David Flanagan,Patrick Niemeyer,Josh Peck,David Flanagan,Mark Grand",O'Reilly Media,June 8th 1997
999,Java Application Frameworks,9780471329305,410,Darren Govoni,John Wiley & Sons,June 25th 1999
1000,Mastering Java 2: J2se 1.4 [With CDROM],9780782140224,800,John Zukowski,Sybex,April 24th 2002
1001,Java Ee 7 Performance Tuning and Optimization,9781782176428,478,Osama Oransa,Packt Publishing,June 14th 2014
1002,Java Script Development,9780127100050,600,John R. Vacca,Academic Press,January 1st 1997
1003,Arquitectura Java Solida,9781291167665,404,Cecilio Álvarez Caules,Lulu.com,November 2nd 2012
1004,The Art of Image Processing with Java,9781568817170,343,Kenny A. Hunt,AK Peters,November 8th 2010
1005,Java Event Handling [With CDROM],9780130418029,624,Grant Palmer,Prentice Hall PTR,August 8th 2001
1006,Professional WebObjects 5.0 with Java,9781861004314,488,"Thomas Termini,Ben Galbraith",Wrox Press,October 23rd 2001
1007,Jogja The Real Java,,,Tourism and Culture Office Yogyakarta,"Tourism and Culture Office, Yogyakarta City Government",2011
1007,ACE Your Java Interview,,176,Jennifer Fu,Tech Collections,April 26th 2013
1009,Java and Mac OS X,9780470525111,492,T. Gene Davis,John Wiley & Sons,May 3rd 2010
1009,Flex 3 with Java,9781847195340,304,Satish Kore,Packt Publishing,June 30th 2009
1011,Programmazione in Java: seconda edizione,9788850330690,536,"Roberto Bruni,Andrea Corradini,Vincenzo Gervasi",Apogeo,September 2011
1012,Programming with Alice and Java,9780321512093,360,"John   Lewis,Peter DePasquale",Addison-Wesley,February 22nd 2008
1013,Java 8 Recipes,9781430268277,640,Josh Juneau,Apress,September 13th 2014
1014,Neues in Java 8,,65,Martin Piskernig,,2014
1015,Fundamentals of Java Comprehensive Course,9780619059637,702,"Kenneth A. Lambert,Martin Osborne",Cengage Learning,July 1st 2002
1016,Computing Fundamentals with Java,9781887902472,720,Rick Mercer,Franklin Beedle & Associates,June 1st 2003
1017,Java Des Guignols,9782070483846,191,John Godey,Gallimard Education,December 1st 1970
1018,Java Made Simple,9780750653398,208,P.K. McBride,Made Simple Books,February 16th 2001
1019,Laboratorio Di Programmazione In Java,9788850321452,268,"Paolo Coppola,Stefano Mizzaro",Apogeo,2004
1020,Applied Evolutionary Algorithms in Java,9781468495263,219,Robert Ghanea-Hercock,Springer,July 24th 2012
1021,Software Development In Java,9780929306261,462,"Sartaj Sahni,Raj Kumar",WWW.Silicon-Press.com,January 1st 2003
1022,COBOL Programmers Swing with Java,9780521546843,282,"E. Reed Doke,Bill C. Hardgrave,Richard A.  Johnson",Cambridge University Press,December 28th 2004
1023,Puzzles in Java: Shaping Beginners,9781466988859,140,Kathiravan Udayakumar,Trafford Publishing,May 14th 2013
1024,Domino Development with Java,9781930110045,472,Anthony S. Patton,Manning Publications,September 1st 2000
1025,Programacion Web Java,9789875263918,,Andres Martinez Quijano,M.P. Ediciones,
1026,The Spy in the Java Sea,9780451029812,,Bill S. Ballinger,"Penguin Group USA, Inc",1966
1027,Compiler Design in Java,9781558605602,416,Allen I. Holub,Morgan Kaufmann Publishers,April 30th 2008
1028,Java Programming + CD,9780393948141,0,K.N. King,W. W. Norton & Company,November 1st 2001
1029,Java Programming. Joyce Farrell,9781285081977,1084,Joyce Farrell,Thomson South-Western,March 1st 2013
1030,Object-Oriented Programming with Java,9780763714352,608,"Barry Holmes,Daniel T. Joyce",Jones & Bartlett Publishers,October 4th 2000
1031,Imbibing Java Web Services,,412,Srinivas Mudunuri,CreateSpace,May 5th 2012
1032,Curso Prático de Java,,426,"Carla Jesus,Ferrão, José M.",FCA - Editora de Informática,January 2013
1033,Java Programming Explorer,9781883577810,820,Neil    Bartlett,Coriolis Group Books,January 1st 1996
1034,Java and J2EE Questions and Answers,,586,Suresh Basandra,Basandra Books,January 14th 2012
1035,Candi in Central Java Indonesia,,129,"Tetty Latupapua,Molly Bondan,Markoes Djajadiningrat",Provincial Government of Central Java Indonesia,November 1982
1036,Java Programming Step-by-Step,,508,Tony Bevis,Ability First Limited,January 1st 2012
1037,Technical Screening - Java Developers,,37,Obi Ogbanufe,,November 14th 2011
1038,Introducing Data Structures with Java,,406,David Cousins,Pearson,June 10th 2011
1039,"Java, XML, and the Jaxp",9780471209072,240,Arthur Griffith,John Wiley & Sons,March 5th 2002
1040,Learn Java the Hard Way,,189,Graham Mitchell,,2013
1041,Beginning Java Web Services,9781861007537,490,"Andre Tost,Meeraj Kunnumpurath,Sean Rhody",Wrox Press,September 1st 2002
1042,Java 1.5 Program Design,9780073044675,0,James P Cohoon,McGraw-Hill Science/Engineering/Math,June 1st 2004
1043,Late Night Advanced Java,9781562764074,624,Vidya Bharat,Ziff Davis Pr,December 1st 1996
1044,Java Closures and Lambda,9781430260004,250,Robert Fischer,Apress,March 24th 2015
1045,Compiling with C# and Java,9780321263605,604,Pat D. Terry,Addison Wesley Publishing Company,October 14th 2004
1046,Java Et Spring,9782746055148,290,Adrien Meaudre,Éd. ENI,2010
1047,Java Under the Hood,9781558604575,450,Allen I. Holub,Morgan Kaufmann Publishers,
1048,Programming Concepts In Java,9780921598305,532,"J.N. Patterson Hume,Christine Stephenson",Holt Software Associates,1998
1049,Schaum's Outline of Programming with Java,9780071369770,162,"Anthony Q. Baxter,Anthony Baxter,Anthony Q. Baxter",McGraw-Hill Companies,July 17th 2001
1050,Java 2 Programmer's Reference,9780072123548,447,"Herbert Schildt,Joe O'Neil",McGraw-Hill Companies,January 1st 2000
1051,Footprint Focus Java,9781908206442,112,Paul Dixon,Footprint Handbooks,January 10th 2012
1052,60 Minute Guide to Java,9781568847115,253,"Ed Tittel,Mark Gaither","John Wiley & Sons, Inc.",October 1995
1053,Dwr Java Ajax Applications,9781847192936,232,Sami Salkosuo,Packt Publishing,October 24th 2008
1054,Advanced Java: Internet Applications,9781576760963,694,Art Gittleman,Addison Wesley Longman,December 31st 2002
1055,.Net Development for Java Programmers,9781590590386,386,"Paul  Gibbons,Gary Cornell",Apress,July 31st 2002
1056,JAVA INTERVIEW QUESTION AND ANSWER FOR FRESHER TO EXPERIENCED: JAVA INTERVIEW QUESTIONS AND ANSWER,,29,S Singh,,August 26th 2015
1057,"Java For Everyone: Compatible with Java 5, 6, and 7, 2nd Edition",,624,Cay S. Horstmann,Wiley,May 1st 2012
1058,"Listening to an Earlier Java: Aesthetics, Gender, and the Music of Wayang in Central Java",9789067182737,186,Sarah Weiss,Brill Academic Publishers,January 1st 2010
1059,A Guide to Programming in Java: Java 2 Platform Standard Edition 5,9781580030724,400,Beth        Brown,"Lawrenceville Press, Inc.",December 31st 2005
1060,"Java in 21 Days, Sams Teach Yourself (Covering Java 8)",9780672337109,720,Rogers Cadenhead,Sams Publishing,January 9th 2016
1061,Programming Mobile Objects with Java [With Contains Java & Desing Patterns Code...],9780471254065,601,Jeff Nelson,John Wiley & Sons,January 11th 1999
1062,Java & Bapi Technology for SAP Java & Bapi Technology for SAP,9780761523055,432,Ken  Kroes,Premier Press,January 1st 2003
1063,Enterprise Java Development on a Budget: Leveraging Java Open Source Technologies,9781590591253,609,"Brian Sam-Bodden,Christopher M. Judd",Apress,September 24th 2004
1064,Java Practice Questions: Upgrade to Java SE 7 Programmer,,275,Esteban Herrera,,June 10th 2013
1065,"The Java Virtual Machine Specification, Java Se 7 Edition",9780133260465,608,"Tim Lindholm,Frank Yellin,Gilad Bracha",Addison-Wesley Professional,February 15th 2013
1066,Do-It-Yourself Java Games: An Introduction to Java Computer Programming,,515,"Annette M. Godtland,Leah Darst",Godtland Software Corporation,December 20th 2013
1067,Programming with VisualAge for Java Version 2.0 [With (2) Contains VisualAge for Java 2.0],9780130212986,417,John Akerley,Prentice Hall PTR,February 25th 1999
1068,programming.java: An Introduction to Programming Using Java: An Introduction to Programming Using Java,9780534371098,640,"Rick Decker,Stuart Hirshfield",Course Technology,December 24th 1999
1069,"Android Boot Camp for Developers Using Java, Comprehensive: A Beginner S Guide to Creating Your First Android Apps",9781133597209,512,"Corinne Hoisington,Hoisington",Course Technology,July 26th 2012
1070,SCJA Sun Certified Java Associate Study Guide (Exam CX-310-019) (Certification Press),9780071490030,590,"Robert Liguori,Edward G. Finegan",McGraw-Hill Osborne,September 1st 2009
1071,"Building Maintainable Software, Java Edition: Ten Guidelines for Future-Proof Code",9781491953518,168,"Joost Visser,Sylvan Rigal,Rob Van Der Leek",O'Reilly Media,January 28th 2016
1072,"Java Open Source Programming: With XDoclet, JUnit, Webwork, Hibernate",9780471463627,459,"Joe Walnes,Ara Abrahamian,Mike Cannon-Brookes,Patrick A. Lightbody",John Wiley & Sons,November 28th 2003
1073,"SCJP: Sun Certified Programmer for Java Platform, SE6 Study Guide [With CDROM]",9780470417973,531,Richard F. Raposa,Sybex,March 23rd 2009
1074,Java 8 Programmer II Study Guide: Exam 1Z0-809,9781530845996,752,Esteban Herrera,,April 7th 2016
1075,"Inside Java 2 Platform Security: Architecture, API Design, and Implementation",9780201787917,384,Li Gong,Addison-Wesley Professional,June 6th 2003
1076,Java Pitfalls: Time-Saving Solutions and Workarounds to Improve Programs,9780471361749,336,Michael C. Daconta,John Wiley & Sons,May 4th 2000
1077,"Server-Side Programming Techniques (Java(TM) Performance and Scalability, Volume 1)",9780201704297,320,Dov Bulka,Addison-Wesley Professional,June 2nd 2000
1078,"Java, La Maîtrise: Java 5 Et 6",9782212122503,200,Jérôme Bougeault,Eyrolles :Tsoft,2008
1079,Migrating from Java 1.0 to Java 1.1 [With CDROM],9781566046862,503,Daniel I. Joshi,Ventana Communications Group,July 19th 1997
1080,"Ivor Horton's Beginning Java, Java 7 Edition",,,Ivor Horton,Wrox Press,September 27th 2011
1081,Handbook of Java Syntax: A Reference to the Java Programming Language,9789526790558,78,Mikael E Olsson,Siforia,March 8th 2013
1082,Intro Java Progr Compreh&ess Java Pkg,9780132090414,,Pearson,Pearson,January 1st 2009
1083,Batik: Fabled Cloth of Java: Fabled Cloth of Java,9781462908691,522,Inger McCabe Elliott,Not Avail,June 16th 2014
1084,M257 Putting Java to Work: Java in the large,,58,Open University,The Open University,2007
1085,Complte Java Traing Crse & Java Lab Mnl,9780131028197,,Prentice Hall PTR,Prentice Hall PTR,
1086,M257 Putting Java to Work: Java everywhere,,42,Open University,The Open University,2007
1087,Decompiling Java: Bytecodes and the Java Virtual Machine,,280,Godfrey Nolan,Apress,July 29th 2004
1088,M257 Putting Java to Work: Java in the small,,50,Open University,The Open University,2007
1089,"A Hole in My Soul, My Father's Sin",9780982058770,126,L. Collins Java,Jimsam Inc. Publishing,June 1st 2009
1090,"JAVA: Java Programming For Beginners: A Simple Start To Java Programming (Written By A Software Engineer) (Programming, Java Programming Language, Computer ... Master's Handbook, Java for Kids Book 1)",,142,"Scott Sanderson,Jared Paulsen",,December 2nd 2014
1091,Java In 8 Hours : Cover All Essential Java Knowledge : Easy & Fast!: A Beginner's Guide : Start Coding Today!,,106,Ray Yao,,March 9th 2015
1092,Oracle Certified Master Java Enterprise Architect Java Ee 7: Certification Guide,9781430250012,700,B.V. Kumar,Apress,February 11th 2015
1093,"Java 8: A Beginner's Guide: Fundamental principles of Java programming (java tutorial, java for beginners, Learn Java, java programming, java 8, java guide, java programming guide for beginners)",,68,"Kevin Lynch,Learning Java",,March 31st 2015
1094,Constructing Intelligent Agents With Java: A Programmer's Guide To Smarter Applications,9780471191353,416,"Joseph P. Bigus,Jennifer Bigus",Wiley,January 7th 1998
1095,"Java Game Programming for Dummies [With Includes Soundforge Xp 4.0b, JDK, Goldwave...]",9780764501685,359,"Wayne Holder,Doug Bell",For Dummies,March 28th 1998
1096,Inside Servlets: Server-Side Programming for the Java¿ Platform (2nd Edition),9780201709063,912,Dustin R. Callaway,Addison-Wesley Professional,May 14th 2001
1097,Sams Teach Yourself Java 2 in 21 Days (4th Edition),9780672326288,840,"Rogers Cadenhead,Laura Lemay",Sams,May 13th 2004
1098,Constructing Intelligent Agents Using Java: Professional Developer's Guide [With CDROM],9780471396017,432,Joseph P. Bigus,John Wiley & Sons,March 13th 2001
1099,Be Prepared for the AP Computer Science Exam in Java,9780965485357,352,"Maria Litvin,Sally Bellacqua,Roger Frank,Dave Wittry",Skylight Pub,April 21st 2003
1100,The Essence of Object-Oriented Programming with Java and UML [With CDROM],9780201734102,320,Bruce E. Wampler,Addison-Wesley Professional,January 5th 2002
1101,Simply Java Programming: An Application-Driven Tutorial Approach,9780131426481,1300,Paul J. Deitel,Pearson,August 17th 2003
