ltable_title,ltable_authors,ltable_publisher,ltable_ISBN13,ltable_publishedYear,ltable_publishedMonth,ltable_pages,rtable_title,rtable_authors,rtable_publisher,rtable_ISBN13,rtable_publishedYear,rtable_publishedMonth,rtable_pages
Rapid Java Web Development,Javier Paniza,CreateSpace Publishing,9.78146E+12,2011,3,328,Rapid Java Web Development,Javier Paniza,Createspace,9.78146E+12,2011,3,328
Java 1.1 Programmer's Reference,"Daniel I. Joshi,Pavel A. Vorobiev","Ventana Communications Group, Incorporated",9.78157E+12,1997,6,1000,The Java 1.1 Programmer's Reference,"Daniel I. Joshi,Pavel A. Vorobiev",Coriolis Group Books,9.78157E+12,1997,7,1000
Oracle 9i Java Programming: Solutions for Developers Using PL/SQL / Edition 1,"HOLM,Sant K. Singh,Kevin Mukhar",Apress,9.78186E+12,2001,12,825,Oracle 9i Java Programming: Solutions for Developers Using Java and PL/SQL,"Bjarki Holm,John  Carnell",Wrox Press,9.78186E+12,2001,12,880
Introducing Java EE 7: A Look at What's New,Josh Juneau,Apress,9.78143E+12,2013,6,240,Introducing Java Ee 7: A Look at What's New,Josh Juneau,Apress,9.78143E+12,2013,6,240
Essential Java Fast: How to write object oriented software for the Internet / Edition 1,John Cowell,Springer London,9.78354E+12,1997,10,186,Essential Java Fast: How to Write Object Oriented Software for the Internet in Java,John Cowell,Springer,9.78354E+12,1997,2,186
Pro Java ME MMAPI: Mobile Media API for Java Micro Edition / Edition 1,Vikram Goyal,Apress,9.78159E+12,2006,4,250,Pro Java ME MMAPI: Mobile Media API for Java Micro Edition,Vikram Goyal,Apress,9.78159E+12,2006,5,267
Programming and Problem Solving with Java / Edition 1,James M. Slack,Brooks/Cole,9.78053E+12,1999,12,848,Programming and Problem Solving with Java,James M. Slack,Course Technology,9.78053E+12,1999,12,848
175 Multiple-Choice Questions in Java,"Maria Litvin,Gary Litvin,Gary Litvin",Skylight Publishing,9.78097E+12,2005,4,144,175 Multiple Choice Questions in Java,Maria Litvin,Skylight Pub,9.78097E+12,2005,4,144
Java Deployment with JNLP and WebStart,Mauro Marinilli,Sams,9.78067E+12,2001,10,512,Java Deployment with Jnlp and Webstart,Mauro Marinilli,Sams Publishing,9.78067E+12,2001,9,512
Java and JMX: Building Manageable Systems,"Heather Kreger,Ward Harold,Leigh Williamson",Addison-Wesley,9.78067E+12,2002,12,592,Java and Jmx: Building Manageable Systems,"Heather Kreger,Leigh Williamson",Addison-Wesley Professional,9.78067E+12,2003,1,592
Java 6 Illuminated: An Active Learning Approach / Edition 2,"Julie Anderson,Herve J. Franceschi",Jones & Bartlett Learning,9.78076E+12,2008,1,1288,Java 6 Illuminated: An Active Learning Approach (Jones and Barlett Illuminated),"Julie Anderson,Hervé J. Franceschi",Jones & Bartlett Learning,9.78076E+12,2008,1,1288
Beginning Java Databases,"MUKHAR,Bjarki Holm,John Carnell,Mark Mamone,Ron Phillips",Apress,9.78186E+12,2001,8,800,Beginning Java Databases,"Kevin Mukhar,John  Carnell",Wrox Press,9.78186E+12,2001,8,973
Developing Java EE 6 applications on JBoss AS7,Francesco Marchioni,Packt Publishing,9.78178E+12,2013,7,326,Developing Java Ee 6 Applications on Jboss As7,Francesco Marchioni,Packt Publishing,9.78178E+12,2013,3,326
Java EE 7 First Look,Ndjobo Armel Fabrice,Packt Publishing,9.78185E+12,2013,11,188,Java Ee 7 First Look,Ndjobo Armel Fabrice,Packt Publishing,9.78185E+12,2013,11,188
Object-Oriented Data Structures Using Java / Edition 2,"Nell Dale,Daniel T. Joyce,Chip Weems",Jones & Bartlett Learning,9.78076E+12,2006,2,779,Object-Oriented Data Structures Using Java,"Nell B. Dale,Daniel T. Joyce,Chip Weems",Jones & Bartlett Publishers,9.78076E+12,2006,2,779
Java 2 Micro Edition,"James White,David A Hemphill",Manning Publications Company,9.78193E+12,2002,4,504,Java 2 Micro Edition,"James     White,David Hemphill,David A. Hemphill",Manning Publications,9.78193E+12,2002,4,504
Programming with Java,"Julia Case Bradley,Anita Millspaugh",McGraw-Hill Higher Education,9.78007E+12,2001,8,720,Programming with Java W/ CD-ROM,"Julia Case Bradley,Anita C. Millspaugh",Irwin/McGraw-Hill,9.78007E+12,2001,8,720
Black Art of Java Game Programming,"Joel Fan,Calin Tenitchi,Eric Ries",Sams,9.78157E+12,1996,11,984,Black Art of Java Game Programming [With CDROM],"Joel Fan,Eric Ries",Waite Group Press,9.78157E+12,1996,11,933
Enterprise Java with UML,"C. T. Arrington,Susan Cardinale,Hugo Scavino",Wiley,9.78047E+12,2001,1,0,Enterprise Java with UML [With CDROM],"C.T. Arrington,Susan Cardinale,Hugo Scavino",John Wiley & Sons,9.78047E+12,2001,1,451
Java 7: A Comprehensive Tutorial,Budi Kurniawan,Brainy Software,2.94015E+12,2014,4,846,Java 7: A Comprehensive Tutorial,Budi Kurniawan,BrainySoftware,9.78098E+12,2014,5,850
Java Quick Reference,"Mike M. Afergan,Mike Afergan",Que,9.78079E+12,1996,7,432,Java Quick Reference,Mike Afergan,Que,9.78079E+12,1996,7,430
Web Service Patterns: Java Edition,Paul B. Monday,Apress,9.78159E+12,2003,4,352,Web Services Patterns: Java Edition,Paul B. Monday,Apress,9.78159E+12,2003,4,352
Java Enterprise Design Patterns: Patterns in Java Volume 3,Mark Grand,Wiley,9.78047E+12,2001,11,496,Java Enterprise Design Patterns: Patterns in Java Volume 3 (With CD-ROM),Mark Grand,Wiley,9.78047E+12,2001,2,416
Java Enterprise Design Patterns: Patterns in Java Volume 3,Mark Grand,Wiley,9.78047E+12,2001,11,496,Java Enterprise Design Patterns: Patterns in Java,Mark Grand,Wiley,9.78047E+12,2002,7,496
Java Enterprise Design Patterns: Patterns in Java Volume 3,Mark Grand,Wiley,9.78047E+12,2001,11,496,Java Enterprise Design Patterns: Patterns in Java: 3,Mark Grand,Wiley,,2001,11,496
Bluetooth Application Programming with the Java APIs,"C Bala Kumar,Paul J. Kline,Timothy J. Thompson",Elsevier Science,9.78156E+12,2003,9,498,Bluetooth Application Programming with the Java APIs,"C. Bala Kumar,Paul J. Kline,Timothy J. Thompson",Morgan Kaufmann Publishers,9.78156E+12,2003,10,498
SCJP Sun Certified Programmer for Java 5 Study Guide (Exam 310-055) / Edition 1,"Kathy Sierra,Bert Bates",McGraw-Hill Professional Publishing,9.78007E+12,2006,1,825,SCJP Sun Certified Programmer for Java 5 Study Guide (Exam 310-055) (Certification Press),"Katherine Sierra,Bert Bates",McGraw-Hill Osborne,9.78007E+12,2006,1,825
Professional Java Programming,"SPELL,George Gongo",Apress,9.78186E+12,2000,12,144,Professional Java Programming,Brett Spell,Wrox Press,9.78186E+12,2000,12,1111
Java from the Beginning / Edition 1,Jan Skansholm,Pearson Education,9.7802E+12,1999,12,540,Java from the Beginning,Jan Skansholm,Addison Wesley Publishing Company,9.7802E+12,1999,12,540
Android Application Development for Java Programmers,James Sheusi,Cengage Learning,9.78113E+12,2012,1,320,Android Application Development for Java Programmers,James Sheusi,Cengage Learning,9.78113E+12,2012,1,320
Imagine That!,Becki Java,Xulon Press,9.7816E+12,2007,3,208,Imagine That!,Becki Java,Xulon Press,9.7816E+12,2007,3,208
Dwr Java Ajax Applications,Sami Salkosuo,Packt Publishing,9.78185E+12,2008,10,232,Dwr Java Ajax Applications,Sami Salkosuo,Packt Publishing,9.78185E+12,2008,10,232
Java 2: In Plain English,"Brian Overland,Michael Morrison",Wiley,9.78076E+12,2001,5,768,Java 2 in Plain English,"Brian Overland,Michael Morrison",Wiley,9.78076E+12,2001,5,768
Building Hybrid Android Apps with Java and JavaScript: Applying Native Device APIs,"Nizamettin Gok,Nitin Khanna","O'Reilly Media, Incorporated",9.78145E+12,2013,8,156,Building Hybrid Android Apps with Java and JavaScript: Applying Native Device APIs,"Nizam,Nitin Khanna",O'Reilly Media,9.78145E+12,2013,8,156
"Java Ee6 Cookbook for Securing, Tuning, and Extending Enterprise Applications",Mick Knutson,Packt Publishing,9.78185E+12,2012,6,356,"Java EE 6 Cookbook for Securing, Tuning, and Extending Enterprise Applications",Mick Knutson,PACKT Publishing,9.78185E+12,2012,6,356
Data Structures with Java,"William Topp,William Ford III",Prentice Hall Professional Technical Reference,9.78013E+12,2005,1,1024,Data Structures with Java,"William H. Ford,William R. Topp",Prentice Hall,9.78013E+12,2005,12,1024
Java: How to Program / Edition 6,"Deitel,Paul J. Deitel,Paul J. Deitel,Paul J. Deitel",Prentice Hall,9.78013E+12,2004,12,1576,Java: How to Program,"Harvey M. Deitel,Paul J. Deitel",Prentice Hall,9.78013E+12,2004,8,1568
Rich Internet Applications with Adobe Flex and Java: Secrets of the Masters,Yakov Fain,SYS-CON Media,9.78098E+12,2006,10,707,Rich Internet Applications with Adobe Flex & Java (Secrets of the Masters),Yakov Fain,SYS-CON Books,9.78098E+12,2007,10,707
Schaum's Outline of Data Structures with Java / Edition 2,John R. Hubbard,"McGraw-Hill Companies, The",9.78007E+12,2007,6,384,Schaum's Outline of Data Structures with Java,John R.  Hubbard,McGraw-Hill Companies,9.78007E+12,2007,7,333
"Java Programming: A Beginners Guide to Learning Java, Step by Step",Troy Dimes,CreateSpace Publishing,9.78151E+12,2015,1,110,"Java Programming: A Beginners Guide to Learning Java, Step by Step",Troy Dimes,,,2015,1,109
XML Development with Java 2,"Michael C. Daconta,Albert J. Saganich",Pearson Education,9.78067E+12,2000,10,448,XML Development with Java 2,"Michael C. Daconta,Al Saganich",Sams,9.78067E+12,2000,10,800
Programming Java on Linux,Nathan Meyers,Pearson Education,9.78157E+12,1999,12,944,Java Programming on Linux,Nathan Meyers,Waite Group Press,9.78157E+12,1999,12,900
Starting Out with Java: From Control Structures through Data Structures / Edition 1,"Tony Gaddis,Godfrey Muganda,Godfrey Muganda",Addison Wesley,9.78032E+12,2006,8,1319,Starting Out with Java: From Control Structures through Data Structures,"Tony Gaddis,Godfrey Muganda",Addison Wesley,9.78032E+12,2006,8,1319
Building Parsers With Java,Steven John Metsker,Addison-Wesley,9.7802E+12,2001,3,400,Building Parsers with Java(tm) [With CD],Steven John Metsker,Addison-Wesley Professional,9.7802E+12,2001,4,400
"JAVA for Beginner's Crash Course: Java for Beginners Guide to Program Java, jQuery, & Java Programming",Quick Start Guides,CreateSpace Publishing,9.78152E+12,2015,12,140,"Java for Beginner's Crash Course: Java for Beginners Guide to Program Java, Jquery, & Java Programming",Quick Start Guides,Createspace Independent Publishing Platform,9.78152E+12,2015,12,140
Practical Liferay: Java-based Portal Applications Development / Edition 1,Poornachandra Sarang,Apress,9.78143E+12,2009,5,384,Practical Liferay: Java-Based Portal Applications Development,Poornachandra Sarang,Apress,9.78143E+12,2009,5,354
Java 3d Programming,Daniel Selman,"O'Reilly Media, Incorporated",9.78193E+12,2002,1,400,Java 3D Programming,Daniel Selman,Manning Publications,9.78193E+12,2002,1,400
Fundamentals Of Computer Science Using Java / Edition 1,David Hughes,Jones & Bartlett Learning,9.78076E+12,2002,1,525,Fundamentals Of Computer Science Using Java,David Hughes,Jones & Bartlett Publishers,9.78076E+12,2002,1,525
Java Servlet and JSP Cookbook,"Bruce W. Perry,Brett McLaughlin","O'Reilly Media, Incorporated",9.7806E+12,2004,1,748,Java Servlet & JSP Cookbook,Bruce W. Perry,O'Reilly Media,9.7806E+12,2004,1,748
Beginning Java Web Services,"Apress,Sean Rhody,Meeraj Kunnumpurath,Andre Tost,Sean Rody",Apress,9.78186E+12,2002,9,450,Beginning Java Web Services,"Andre Tost,Meeraj Kunnumpurath,Sean Rhody",Wrox Press,9.78186E+12,2002,9,490
QuickTime Java: A developer's Notebook,Chris Adamson,"O'Reilly Media, Incorporated",9.7806E+12,2005,1,256,QuickTime for Java: A Developer's Notebook: A Developer's Notebook,Chris Adamson,O'Reilly Media,9.7806E+12,2005,1,256
Google App Engine Java And Gwt Application Development,"Daniel Guermeur,Amy Unruh",Packt Publishing,9.78185E+12,2010,11,480,Google App Engine Java and GWT Application Development,"Daniel Guermeur,A. Unruh",Packt Publishing,9.78185E+12,2010,11,480
Agile Java: Crafting Code with Test-Driven Development / Edition 1,Jeff Langr,Prentice Hall,9.78013E+12,2005,2,792,Agile Java: Crafting Code with Test-Driven Development,Jeff Langr,Prentice Hall PTR,9.78013E+12,2005,2,752
Next Generation Java Testing: TestNG and Advanced Concepts / Edition 1,"Cedric Beust,Hani Suleiman",Addison-Wesley,9.78032E+12,2007,10,483,Next Generation Java Testing: TestNG and Advanced Concepts,"Cedric Beust,Hani Suleiman",Addison-Wesley Professional,9.78032E+12,2007,11,482
Eclipse Web Tools Platform: Developing Java Web Applications,Naci Dai,Pearson Education,9.78013E+12,2007,5,752,Eclipse Web Tools Platform: Developing Java Web Applications,"Naci Dai,Arthur Ryman",Addison-Wesley Professional,9.78032E+12,2007,5,724
Developing Mainframe Java Applications,Lou Marco,Wiley,9.78047E+12,2001,7,448,Developing Mainframe Java Applications,Lou Marco,John Wiley & Sons,9.78047E+12,2001,8,464
Java Man,Harris Gray,HarrisGray,9.78099E+12,2013,10,340,Java Man,Harris Gray,Harrisgray,9.78099E+12,2013,11,340
An Introduction to Programming and Object-Oriented Design Using Java / Edition 3,Jaime Nino,Wiley,9.78047E+12,2008,2,1040,An Introduction to Programming and Object-Oriented Design Using Java,"Jaime Nino,Frederick A. Hosch",John Wiley & Sons,9.78047E+12,2008,1,1009
Definitive Guide to Swing for Java 2,John Zukowski,Apress,9.78189E+12,2000,11,890,Definitive Guide to Swing for Java 2,John Zukowski,Apress,9.78189E+12,2000,11,890
Java Ee 5 Development Using Glassfish Application Server,David Heffelfinger,Packt Publishing,9.78185E+12,2007,9,424,Java Ee 5 Development Using Glassfish Application Server,David Heffelfinger,Packt Publishing,9.78185E+12,2007,9,424
Java 6 New Features,Budi Kurniawan,BrainySoftware,9.78098E+12,2006,10,320,Java 6 New Features,Budi Kurniawan,BrainySoftware,9.78098E+12,2006,10,320
Mac OS X for Java Geeks,Will Iverson,"O'Reilly Media, Incorporated",9.7806E+12,2003,4,304,Mac OS X for Java Geeks,Will Iverson,O'Reilly Media,9.7806E+12,2003,5,296
Java Security Handbook,"Jamie Jaworski,Venkata S. Chaganti,Venkata S. Chaganti,Paul J. Perrone,Paul J. Perrone",Sams,9.78067E+12,2000,9,534,Java Security Handbook,"Jamie Jaworski,Paul Perrone",Sams,9.78067E+12,2000,9,552
Java 2 Database Programming for Dummies,"Jim Keogh,James Edward Keogh",Wiley,9.78076E+12,2001,10,408,Java 2 Database Programming for Dummies Java 2 Database Programming for Dummies Java 2 Database Programming for Dummies Java 2 Database Programming for Dummies,Jim Keogh,For Dummies,9.78076E+12,2001,10,408
The Java EE 6 Tutorial: Advanced Topics,Eric Jendrock,Pearson Education,9.78014E+12,2013,1,560,The Java Ee 6 Tutorial: Advanced Topics,"Eric Jendrock,Ricardo Cervera-Navarro,Ian Evans,Devika Gollapudi,Kim Haase,William Markito,Chinmayee Srivathsa",Addison-Wesley Professional,9.78014E+12,2012,12,560
Introduction to Java Programming: Fundamentals First (Core Version) / Edition 6,Y. Daniel Liang,Prentice Hall,9.78013E+12,2006,7,704,Introduction to Java Programming: Fundamentals First,Y. Daniel Liang,Prentice Hall,9.78013E+12,2006,6,678
Beginning Database-Driven Application Development in Java EE: Using GlassFish,Yuli Vasiliev,Apress,9.78143E+12,2008,9,400,Beginning Database-Driven Application Development in Java EE: Using GlassFish,Yuli Vasiliev,Apress,9.78143E+12,2008,9,409
Data Structures and Abstractions with Java / Edition 2,"Frank Carrano,Walter Savitch",Prentice Hall,9.78013E+12,2006,8,1024,Data Structures and Abstractions with Java,"Frank M. Carrano,Walter J. Savitch",Prentice Hall,9.78013E+12,2006,8,998
Java SE 7 Programming Essentials,Michael Ernest,Wiley,9.78112E+12,2012,11,336,Java SE 7 Programming Essentials,Michael Ernest,Sybex,9.78112E+12,2012,11,314
Principles of Database Systems with Internet and Java Applications / Edition 1,"Gregory Riccardi,Greg Riccardi",Pearson,9.7802E+12,2000,7,518,Principles of Database Systems with Internet and Java Applications,Greg Riccardi,Addison-Wesley,9.7802E+12,2000,8,518
Data Structures in Java: From Abstract Data Types to the Java Collections Framework / Edition 1,Simon Gray,Pearson,9.78032E+12,2006,11,688,Data Structures in Java: From Abstract Data Types to the Java Collections Framework,Simon Gray,Addison Wesley Publishing Company,9.78032E+12,2006,10,658
Java Programming 10-Minute Solutions,Mark Watson,Wiley,9.78078E+12,2004,2,332,Java Programming 10-Minute Solutions,Mark   Watson,Sybex,9.78078E+12,2004,2,318
Java: First Contact / Edition 2,"Roger Garside,John Mariani",Cengage Learning,9.78185E+12,1997,10,660,Java: First Contact,"Roger Garside,John Mariani",Course Technology,9.78185E+12,1997,9,660
Java Programming: Introductory / Edition 1,Joyce Farrell,Cengage Learning,9.78076E+12,1998,10,319,Java Programming: Introductory,Joyce Farrell,Course Technology,9.78076E+12,1998,10,319
Java Developer's Reference,"Mike Cohn,Coh,Tom Trinko,Dan Joshi,Michael T. Nygard",Sams,9.78158E+12,1996,9,1296,Java Developer's Reference: With CDROM,"Mike Cohn,Michael Morrison,Michael T. Nygard,Dan Joshi,Tom Trinko",Sams,9.78158E+12,1996,10,1258
Java Threads and the Concurrency Utilities,JEFF FRIESEN,Apress,9.78148E+12,2015,11,200,Java Threads and the Concurrency Utilities,Jeff Friesen,Apress,9.78148E+12,2015,11,200
Programming with Java,"Barry Holmes,Holmes",Jones & Barlett Learning,9.78076E+12,1998,4,608,Programming with Java,Barry Holmes,Jones & Bartlett Publishers,9.78076E+12,1998,1,587
Pure Java 2,Kenneth Litwak,Sams,9.78067E+12,1999,12,790,Pure Java 2 (Pure),Kenneth Litwak,Sams,9.78067E+12,1999,12,816
Java Precisely,Peter Sestoft,MIT Press,9.78026E+12,2002,6,128,Java Precisely,Peter Sestoft,MIT Press (MA),9.78026E+12,2002,6,118
Essential Java Style : Patterns for Implementation,"Jeff Langr,Jeff Lnagr",Pearson Education,9.78013E+12,1999,8,277,Essential Java Style: Patterns for Implementation,Jeff Langr,Prentice Hall PTR,9.78013E+12,1999,8,277
Java Tutorial for the Real World,Yakov Fain,"Smart Data Processing, Incorporated",9.78097E+12,2002,8,304,The Java Tutorial for the Real World,Yakov Fain,"Smart Data Processing, Inc.",9.78097E+12,2002,8,304
The Java Programming Language / Edition 4,"Ken Arnold,James Gosling,David Holmes",Addison-Wesley,9.78032E+12,2005,9,912,The Java Programming Language,"Ken Arnold,James Gosling,David Holmes",Addison-Wesley,9.78032E+12,2005,8,891
A Guide to Programming in Java: For Java SE 5 and Java SE 6,Beth Brown,"Lawrenceville Press, Incorporated",9.78158E+12,2007,3,528,A Guide to Programming in Java: For Java Se 5 and Java Se 6,Beth        Brown,"Lawrenceville Press, Inc.",9.78158E+12,2007,1,400
Undocumented Secrets of MATLAB-Java Programming,Yair M. Altman,Taylor & Francis,9.78144E+12,2011,12,701,Undocumented Secrets of MATLAB-Java Programming,Yair M. Altman,CRC Press,9.78144E+12,2011,12,701
Intelligence Unleashed: Creating LEGO NXT Robots with Java,Brian Bagnall,Variant Press,9.78099E+12,2011,9,524,LEGO NXT Robots Unleashed: Creating Intelligence with Java,Brian  Bagnall,Variant Press,9.78099E+12,2011,9,524
Tantric Temples: Eros and Magic in Java,Peter Levenda,"Nicolas-Hays, Incorporated",9.78089E+12,2011,11,1,Tantric Temples: Eros and Magic in Java,Peter Levenda,Ibis Press,9.78089E+12,2011,11,367
Object-Oriented Programming With Java / Edition 2,"Barry Holmes,Daniel T. Joyce",Jones & Bartlett Learning,9.78076E+12,2000,10,608,Object-Oriented Programming with Java,"Barry Holmes,Daniel T. Joyce",Jones & Bartlett Publishers,9.78076E+12,2000,10,608
Hacking Java: The Java Professional Resource Kit,"Mark Wutka,David Baker,David Boswell,Ken Cartwright,David Edgar Liebke",Que,9.78079E+12,1996,11,888,Hacking Java: The Professional's Resource Kit,"Que Corporation,David Baker,Mark Wutka,David  Boswell",Que,9.78079E+12,1996,11,852
Java Database Programming with JBBC,"Pratik Patel,Patel",Coriolis Group,9.78158E+12,1996,9,500,Java Database Programming with JDBC,Pratik Patel,Coriolis Group Books,9.78158E+12,1996,1,480
Java Server and Servlets: Building Portable Web Applications,"Peter Rossbach,Hendrik Schreiber",Pearson Education,9.7802E+12,2000,4,304,Java Server and Servlets: Building Portable Web Applications,Peter Robach,Addison-Wesley Professional,9.7802E+12,2000,3,448
J2EE / Java EE kompakt: Enterprise Java: Konzepte und Umfeld,"Arne Koschel,Stefan Fischer,Gerhard Wagner",Spektrum Akademischer Verlag,9.78383E+12,2006,7,132,J2EE/Java EE Kompakt: Enterprise Java: Konzepte Und Umfeld,"Arne Koschel,Stefan Fischer,Gerhard Wagner",Spektrum Akademischer Verlag,9.78383E+12,2006,7,132
Java Power Tools,John Ferguson Smart,"O'Reilly Media, Incorporated",9.7806E+12,2008,4,871,Java Power Tools,John  Smart,O'Reilly Media,9.7806E+12,2008,4,912
Java Power Tools,John Ferguson Smart,"O'Reilly Media, Incorporated",9.7806E+12,2008,4,871,Java Power Tools,John Ferguson Smart,O'Reilly Media,9.7806E+12,2008,4,910
Taming Java Threads,"Allen Holub,Allen Hollub",Apress,9.78189E+12,2000,6,300,Taming Java Threads,Allen I. Holub,Apress,9.78189E+12,2000,6,300
OSGi and Equinox: Creating Highly Modular Java Systems,"Jeff McAffer,Paul VanderLei,Simon Archer",Addison-Wesley,9.78032E+12,2010,2,475,Osgi and Equinox: Creating Highly Modular Java Systems,"Jeff McAffer,Paul VanderLei,Simon Archer",Addison-Wesley Professional,9.78032E+12,2010,2,509
Pro JPA 2: Mastering the Java Persistence API / Edition 1,"Mike Keith,Merrick Schincariol,Jeremy Keith",Apress,9.78143E+12,2009,12,500,Pro JPA 2: Mastering the Java Persistence API,"Mike Keith,Merrick Schincariol",Apress,9.78143E+12,2009,11,503
Pro JPA 2: Mastering the Java Persistence API / Edition 1,"Mike Keith,Merrick Schincariol,Jeremy Keith",Apress,9.78143E+12,2009,12,500,Pro JPA 2: Mastering the Java Persistence API,Merrick Schincariol,Apress L. P.,9.78143E+12,2009,12,0
Java Language Reference,Mark Grand,"O'Reilly Media, Incorporated",9.78157E+12,1997,1,464,Java Language Reference,Mark Grand,O'Reilly Media,9.78157E+12,1997,8,492
"Java for RPG Programmers, 2nd Edition","Phil Coulthard,George Farr",Mc Press,9.78193E+12,2002,11,800,Java for RPG Programmers,"Phil Coulthard,George Farr",Mc Press,9.78193E+12,2002,3,820
Java Web Magic (with CD-ROM),"Joseph T. Sinclair,Lee Callister",Macmillan Computer Publishing,9.78157E+12,1997,3,224,Java Web Magic with CD,Joseph T. Sinclair,Hayden Books,9.78157E+12,1997,1,256
Java Network Programming and Distributed Computing,David Reilly,Addison-Wesley,9.7802E+12,2002,3,464,Java Network Programming and Distributed Computing,"David Reilly,Michael Reilly",Addison-Wesley Professional,9.7802E+12,2002,4,496
Java 2 for the World Wide Web: Visual QuickStart Guide,Dori Smith,Pearson Education,9.7802E+12,2002,2,300,Java 2 for the World Wide Web: Visual QuickStart Guide,Dori Smith,Peachpit Press,9.7802E+12,2002,2,360
"Java for Business: Using Java to Win Customers, Cut Costs, and Drive Growth",Thomas Anderson,Wiley,9.78047E+12,1997,6,368,"Java for Business: Using Java to Win Customers, Cut Costs, and Drive Growth",Thomas Anderson,Van Nostrand Reinhold Company,9.78044E+12,1997,1,354
Java 8 Recipes,Josh Juneau,Apress,9.78143E+12,2014,9,640,Java 8 Recipes,Josh Juneau,Apress,9.78143E+12,2014,9,640
A Peaceful Jihad: Negotiating Identity and Modernity in Muslim Java,"R. Lukens-Bull,Robert Hefner",Palgrave Macmillan US,9.7814E+12,2005,5,176,A Peaceful Jihad: Negotiating Identity and Modernity in Muslim Java,Ronald Lukens-Bull,Palgrave Macmillan,9.7814E+12,2005,5,176
"Bali, Java in My Dreams","Christine Jordis,George Blanda,Sacha Jordis",Random House UK,9.78186E+12,2003,2,192,"Bali, Java, in My Dreams",Christine Jordis,Random House UK,9.78186E+12,2003,11,192
Java for Dummies Quick Reference,"Stephen D. Lockwood,Madhu Siddalingaiah","Wiley, John & Sons, Incorporated",9.78076E+12,1997,4,240,Java for Dummies Quick Reference,"Stephen D. Lockwood,Madhu Siddalingaiah",For Dummies,9.78076E+12,1997,5,224
Object-Oriented Software Design and Construction with Java / Edition 1,Dennis Kafura,Prentice Hall,9.78013E+12,2000,2,450,Object-Oriented Software Design and Construction with Java,Dennis Kafura,Prentice Hall,9.78013E+12,2000,2,656
Java Data Objects,"David Jordan,Craig Russell","O'Reilly Media, Incorporated",9.7806E+12,2003,4,382,Java Data Objects,"David   Jordan,Craig    Russell,Craig Russell",O'Reilly Media,9.7806E+12,2003,4,382
Java Design Patterns: A Tutorial / Edition 1,"James W. Cooper,James Cooper",Addison-Wesley,9.7802E+12,2000,4,352,Java Design Patterns: A Tutorial,James W. Cooper,Addison-Wesley Professional,9.7802E+12,2000,2,352
Alice in Action with Java? / Edition 1,Joel Adams,Cengage Learning,9.78142E+12,2007,1,640,Alice in Action with Java,Joel Adams,Course Technology,9.78142E+12,2007,1,616
Computer Graphics Using Java 2D and 3D / Edition 1,"Hong Zhang,Y. Daniel Liang",Pearson,9.78013E+12,2005,10,632,Computer Graphics Using Java 2D and 3D,Hong Zhang,Prentice Hall,9.78013E+12,2006,11,462
Programming With Java: A Multimedia Approach,Radhika S Grover,Jones & Bartlett Learning,9.78145E+12,2011,10,704,Programming with Java: A Multimedia Approach [With CDROM],Radhika S Grover,Jones & Bartlett Publishers,9.78145E+12,2011,10,698
Programming With Java: A Multimedia Approach,Radhika S Grover,Jones & Bartlett Learning,9.78145E+12,2011,10,704,Programming with Java: A Multimedia Approach,Radhika S Grover,Jones & Bartlett Publishers,9.78145E+12,2011,12,728
Data Structures Using Java / Edition 1,Moshe J. Augenstein,Pearson,9.78013E+12,2003,3,670,Data Structures Using Java,"Moshe J. Augenstein,Aaron M. Tenenbaum,Yedidyah Langsam",Pearson,9.78013E+12,2003,3,670
Batik: Fabled Cloth of Java,Inger McCabe Elliot,Tuttle Publishing,9.78146E+12,2013,1,240,Batik: Fabled Cloth of Java,"Inger McCabe Elliot,Brian Brake",Periplus Editions,,2013,1,240
Java Programming for Spatial Sciences,Jo Wood,Taylor & Francis,9.78042E+12,2002,5,336,Java Programming for Spatial Sciences,Jo Wood,CRC Press,9.78042E+12,2002,5,336
Introduction to Java / Edition 1,Stephen J. Chapman,Prentice Hall,9.78014E+12,1999,6,344,Introduction to Java,Stephen J. Chapman,Prentice Hall,9.78014E+12,1999,6,344
Essential Java for Scientists and Engineers,"Brian D. Hahn,Katherine M. Malan",Elsevier Science & Technology Books,9.78075E+12,2002,10,352,Essential Java for Scientists and Engineers,Brian D. Hahn,Butterworth-Heinemann,9.78075E+12,2002,6,338
