ltable_title,ltable_authors,ltable_publisher,ltable_ISBN13,ltable_publishedYear,ltable_publishedMonth,ltable_pages,rtable_title,rtable_authors,rtable_publisher,rtable_ISBN13,rtable_publishedYear,rtable_publishedMonth,rtable_pages
"Java: The Ultimate Guide to Learn Java and SQL Programming (Programming, Java, Database, Java for dummies, coding books, java programming)","Peter Hoffman,Stephen Hoffman",CreateSpace Publishing,9.78152E+12,2016,2,84,"Java: The Ultimate Guide to Learn Java and Python Programming (Programming, Java, Database, Java for Dummies, Coding Books, Java Programming)","Peter Hoffman,Stephen Hoffman,Java Programming",Createspace Independent Publishing Platform,9.78152E+12,2016,2,100
"OCA/OCP Oracle Database 11g All-in-One Exam Guide: Exams 1Z0-051, 1Z0-052, 1Z0-053",John Watson,McGraw-Hill Education,9.78007E+12,2009,9,1050,"OCA/OCP Oracle Database 11g All-in-One Exam Guide with CD-ROM: Exams 1Z0-051, 1Z0-052, 1Z0-053 (Oracle Press)","John    Watson,Bob Bryla,Roopesh Ramklass",McGraw-Hill Osborne Media,9.78007E+12,2009,8,1050
SQL Server 2014 Database Design,Kalman Toth,CreateSpace Publishing,9.7815E+12,2014,5,464,SQL Server 2014 Database Design,Kalman Toth,,,2014,5,464
RMAN Recipes for Oracle Database 11g: A Problem-Solution Approach / Edition 1,"Sam Alapati,Darl Kuhn,Arup Nanda",Apress,9.78159E+12,2007,8,670,RMAN Recipes for Oracle Database 11g: A Problem-Solution Approach,"Darl Kuhn,Arup Nanda",Apress,9.78159E+12,2007,9,670
"DB2 9.7 for Linux, UNIX, and Windows Database Administration: Certification Study Notes",Roger E. Sanders,Mc Press,9.78158E+12,2011,11,160,"DB2 9.7 for Linux, UNIX, and Windows Database Administration: Certification Study Notes",Roger E. Sanders,Mc Press,9.78158E+12,2011,11,160
Database Systems Using Oracle: A Simplified Guide to SQL and PL/SQL / Edition 2,Nilesh Shah,Pearson,9.78013E+12,2004,5,456,Database Systems Using Oracle: A Simplified Guide to SQL and PL/SQL,Nilesh Shah,Prentice Hall,9.78013E+12,2004,5,432
Visual Basic.NET Database Programming For Dummies,"Richard Mansfield,Mansfield",Wiley,9.78076E+12,2001,11,408,Visual Basic .Net Database Programming for Dummies,Richard Mansfield,For Dummies,9.78076E+12,2001,11,412
Databases A Beginner's Guide / Edition 1,"Andy Oppel,Andrew J. Oppel",McGraw-Hill Professional Publishing,9.78007E+12,2009,3,496,Databases A Beginner's Guide,Andy Oppel,McGraw-Hill Osborne Media,9.78007E+12,2009,3,496
Oracle Database 11g The Complete Reference / Edition 1,Kevin Loney,McGraw-Hill Professional Publishing,9.78007E+12,2008,12,1368,Oracle Database 11g: The Complete Reference,Kevin Loney,McGraw-Hill/Osborne Media,9.78007E+12,2009,1,1334
Oracle Database 11g The Complete Reference / Edition 1,Kevin Loney,McGraw-Hill Professional Publishing,9.78007E+12,2008,12,1368,Oracle Database 11g The Complete Reference (Oracle Press),Kevin Loney,McGraw-Hill Osborne Media,,2008,12,1368
Database Nation: The Death of Privacy in the 21st Century,Simson Garfinkel,"O'Reilly Media, Incorporated",9.7806E+12,2000,12,338,Database Nation: The Death of Privacy in the 21st Century,Simson Garfinkel,O'Reilly Media,9.7806E+12,2000,12,338
Marketing Database Analytics: Transforming Data for Competitive Advantage,Andrew D. Banasiewicz,Taylor & Francis,9.78042E+12,2013,5,400,Marketing Database Analytics: Transforming Data for Competitive Advantage,Andrew D. Banasiewicz,Routledge,9.78042E+12,2013,5,376
Oracle Database 11g A Beginner's Guide / Edition 1,"Ian Abramson,Michael Abbey,Michael Corey",McGraw-Hill Professional Publishing,9.78007E+12,2008,12,432,Oracle Database 11g: A Beginner's Guide,"Ian Abramson,Michael Abbey,Michael J. Corey",McGraw-Hill/Osborne Media,9.78007E+12,2008,12,410
Joe Celko's Complete Guide to NoSQL: What Every SQL Professional Needs to Know about Non-Relational Databases,Joe Celko,Elsevier Science,9.78012E+12,2013,10,244,Joe Celko's Complete Guide to NoSQL: What Every SQL Professional Needs to Know about Non-Relational Databases,Joe Celko,Morgan Kaufmann Publishers,9.78012E+12,2013,10,224
Time and Relational Theory: Temporal Databases in the Relational Model and SQL,"C.J. Date,Nikos Lorentzos,Hugh Darwen",Elsevier Science,9.78013E+12,2014,7,560,Time and Relational Theory: Temporal Databases in the Relational Model and SQL,"C.J. Date,Nikos Lorentzos,Hugh Darwen",Morgan Kaufmann Publishers,9.78013E+12,2014,7,560
Oracle Database Problem Solving and Troubleshooting Handbook / Edition 1,"Tariq Farooq,Mike Ault,Paulo Portugal,Mohamed Houri,Syed Jaffar Hussain",Addison-Wesley,9.78013E+12,2016,5,512,Oracle Database Problem Solving and Troubleshooting Handbook,"Mike Ault,Jim Czuprynski,Guy Harrison,Mohamed Houri,Syed Jaffar Hussain,Paulo Portugal,Biju Thomas,Tariq Farooq",Addison-Wesley Professional,9.78013E+12,2016,4,512
Database Design and Relational Theory: Normal Forms and All That Jazz,C. J. Date,"O'Reilly Media, Incorporated",9.78145E+12,2012,4,278,Database Design and Relational Theory: Normal Forms and All That Jazz,C.J. Date,O'Reilly Media,9.78145E+12,2012,4,278
Android Database Best Practices / Edition 1,Adam Stroud,Addison-Wesley,9.78013E+12,2016,8,288,Android Database Best Practices,Adam Stroud,Addison-Wesley Professional,9.78013E+12,2016,8,288
Oracle Database 11g SQL / Edition 1,Jason Price,McGraw-Hill Professional Publishing,9.78007E+12,2007,11,688,Oracle Database 11g SQL,Jason Price,McGraw-Hill/Osborne Media,9.78007E+12,2007,11,656
Murach's ADO. NET 4 Database Programming with C# 2010,"Anne Boehm,Ged Mead","Murach, Mike & Associates, Inc.",9.78189E+12,2011,4,334,Murach's ADO.NET 4 Database Programming with C# 2010,"Anne Boehm,Ged Mead",Mike Murach & Associates,9.78189E+12,2011,4,712
OCA Oracle Database 11g SQL Fundamentals I Exam Guide: Exam 1Z0-051,"Watson,Ramklass",McGraw-Hill Education,9.78007E+12,2008,6,581,OCA Oracle Database 11g: SQL Fundamentals I Exam Guide (Exam 1Z0-051) [With CDROM],Roopesh Ramklass,McGraw-Hill/Osborne Media,9.78007E+12,2008,6,573
Database Administration Fundamentals: MTA 98-364 / Edition 1,Microsoft Official Academic Course,Wiley,9.78047E+12,2011,7,144,Database Administration Fundamentals: Exam 98-364,MOAC (Microsoft Official Academic Course),John Wiley & Sons,9.78047E+12,2011,7,113
Oracle Database 12c PL/SQL Advanced Programming Techniques,"Michael McLaughlin,John Harper",McGraw-Hill Professional Publishing,9.78007E+12,2014,11,416,Oracle Database 12c PL/SQL Programming,Michael McLaughlin,McGraw-Hill Education,9.78007E+12,2014,2,1192
Database Systems - Introduction to Databases and Data Warehouses / Edition 1,"Nenad Jukic,Susan Vrbsky,Svetlozar Nestorov",Pearson,9.78013E+12,2013,1,408,Database Systems: Introduction to Databases and Data Warehouses,Nenad Jukic,Pearson,9.78013E+12,2013,1,408
Database Development For Dummies,Allen G. Taylor,Wiley,9.78076E+12,2000,11,360,Database Development for Dummies,Allen G. Taylor,For Dummies,9.78076E+12,2000,11,360
PostgreSQL: Up and Running: A Practical Introduction to the Advanced Open Source Database,"Regina O. Obe,Leo S. Hsu","O'Reilly Media, Incorporated",9.78145E+12,2015,1,234,PostgreSQL: Up and Running: A Practical Introduction to the Advanced Open Source Database,"Regina O. Obe,Leo S Hsu",O'Reilly Media,9.78145E+12,2015,1,234
Manga Guide to Databases,"Mana Takahashi,Shoko Azuma,Ltd. Trend-Pro Co.","No Starch Press San Francisco, CA",9.78159E+12,2008,12,224,The Manga Guide to Databases,"Mana Takahashi,Shoko Azuma,Trend-Pro Co. Ltd.",No Starch Press,9.78159E+12,2009,2,224
Study Guide for 1Z0-144: Oracle Database 11g: Program with PL/SQL: Oracle Certification Prep,Matthew Morris,CreateSpace Publishing,9.78148E+12,2012,7,178,Study Guide for 1Z0-144: Oracle Database 11g: Program with PL/SQL (Oracle Certification Prep),Matthew Morris,Matthew Morris,,2012,7,178
Oracle Database 12c DBA Handbook,Bob Bryla,McGraw-Hill Professional Publishing,9.78007E+12,2015,6,744,Oracle Database 12c DBA Handbook,Bob Bryla,McGraw-Hill Education,9.78007E+12,2015,7,704
Concepts of Database Management / Edition 8,"Philip J. Pratt,Mary Z. Last",Cengage Learning,9.78129E+12,2014,9,432,Concepts of Database Management,"Phil Pratt,Mary  Last",Cengage Learning,9.78129E+12,2014,9,432
Librarian's Guide to Online Searching: Cultivating Database Skills for Research and Instruction / Edition 4,Suzanne S. Bell,Libraries Unlimited,9.78161E+12,2015,2,320,"Librarian's Guide to Online Searching: Cultivating Database Skills for Research and Instruction, 4th Edition",Suzanne S Bell,Libraries Unlimited,9.78161E+12,2015,2,320
Training Kit Exam 70-462: Administering Microsoft SQL Server 2012 Databases,"Orin Thomas,Peter Ward,Bob Taylor",Microsoft Press,9.78074E+12,2012,7,624,Training Kit (Exam 70-462): Administering Microsoft SQL Server 2012 Databases,"Orin Thomas,Neil Hambly,Peter D. Ward",Microsoft Press,9.78074E+12,2012,7,624
"Database Systems: Design, Implementation, & Management / Edition 11","Carlos Coronel,Steven Morris",Cengage Learning,9.78129E+12,2014,2,784,"Database Systems: Design, Implementation, & Management","Carlos Coronel,Steven Morris",Cengage Learning,,2014,2,784
Database Administration: The Complete Guide to DBA Practices and Procedures / Edition 2,Craig S. Mullins,Addison-Wesley,9.78032E+12,2012,10,890,Database Administration: The Complete Guide to DBA Practices and Procedures,Craig S Mullins,Addison-Wesley Professional,9.78013E+12,2012,10,936
Essentials of Database Management / Edition 1,"Jeffrey A. Hoffer,Heikki Topi,Ramesh Venkataraman",Pearson,9.78013E+12,2013,7,408,Essentials of Database Management,"Jeffrey A. Hoffer,Heikki Topi,Ramesh Venkataraman",Prentice Hall,9.78013E+12,2013,6,378
OCA Oracle Database 11g Administration I Exam Guide (Exam 1Z0-052) / Edition 1,John Watson,McGraw-Hill Professional Publishing,9.78007E+12,2008,5,733,OCA Oracle Database 11g Administration I Exam Guide (Exam 1Z0-052): Administration 1 Exam Guide,John    Watson,McGraw-Hill Osborne,9.78007E+12,2008,6,733
Oracle Database 12c Performance Tuning Recipes: A Problem-Solution Approach,"Sam Alapati,Darl Kuhn,Bill Padfield",Apress,9.78143E+12,2013,12,636,Oracle Database 12c Performance Tuning Recipes: A Problem-Solution Approach,"Sam Alapati,Darl Kuhn,Bill Padfield",Apress,9.78143E+12,2013,12,636
Pro Oracle Database 12c Administration / Edition 2,Darl Kuhn,Apress,9.78143E+12,2013,7,756,Pro Oracle Database 12c Administration,Darl Kuhn,Apress,9.78143E+12,2013,7,756
Web Database Applications with PHP and MySQL 2E,"Hugh E. Williams,David Lane","O'Reilly Media, Incorporated",9.7806E+12,2004,5,820,Web Database Applications with PHP and MySQL,"Hugh E. Williams,Andy Oram,David Lane",O'Reilly Media,9.7806E+12,2004,5,796
Database of Dreams: The Lost Quest to Catalog Humanity,Rebecca Lemov,Yale University Press,9.7803E+12,2015,11,368,Database of Dreams: The Lost Quest to Catalog Humanity,Rebecca Lemov,Yale University Press,9.7803E+12,2015,11,368
Oracle Database 12c PL/SQL Programming / Edition 1,Michael McLaughlin,McGraw-Hill Professional Publishing,9.78007E+12,2014,2,1192,Oracle Database 12c PL/SQL Programming,Michael McLaughlin,McGraw-Hill Education,9.78007E+12,2014,2,1192
Sams Teach Yourself Beginning Databases in 24 Hours,"Ryan Stephens,Ron Plew",Sams,9.78067E+12,2003,1,480,Sams Teach Yourself Beginning Databases in 24 Hours,"Ryan K. Stephens,Ronald R. Plew",Sams Publishing,9.78067E+12,2003,5,480
Easy Oracle Jumpstart: Oracle Database Management Concepts and Administration,Don Burleson,Rampant TechPress,9.78098E+12,2006,9,212,Easy Oracle Jumpstart: Oracle Database Management Concepts and Administration,"Robert G. Freeman,Steve Karam,Donald K. Burleson",Rampant Techpress,9.78098E+12,2006,2,219
"Advanced Topics In Database Research, Volume 4",Keng Siau,IGI Global,9.78159E+12,2005,3,392,"Advanced Topics in Database Research, Volume 5",Keng Siau,IGI Global,9.78159E+12,2006,4,460
Database Transaction Models for Advanced Applications,Ahmed K. Elmagarmid,Elsevier Science,9.78156E+12,1992,4,611,Database Transaction Models For Advanced Applications,Ahmed K. Elmagarmid,Morgan Kaufmann Publishers,9.78156E+12,1992,4,611
MCSE Microsoft SQL Server 2000: Database Design and Implementation Readiness Review,"Sharon Bjeletich,Eddy Hahn",Microsoft Press,9.78074E+12,2001,5,232,MCSE Microsoft SQL Server 2000 Database Design and Implementation Readiness Review  Exam 7,"Sharon Bjeletich,Eddy Hahn3586",Microsoft Press,9.78074E+12,2001,5,232
Data Management: Databases & Organizations / Edition 5,Richard T. Watson,Wiley,9.78047E+12,2005,8,640,Data Management: Databases & Organizations,Richard T. Watson,Wiley,9.78047E+12,2005,9,640
RMAN Recipes for Oracle Database 12c: A Problem-Solution Approach,"Darl Kuhn,Sam Alapati,Arup Nanda",Apress,9.78143E+12,2013,7,796,RMAN Recipes for Oracle Database 12c: A Problem-Solution Approach,"Darl Kuhn,Sam Alapati,Arup Nanda",Apress,9.78143E+12,2013,7,796
Mastering Visual Basic .Net Database Programming,"Evangelos Petroutsos,Asli Bilgin","Wiley, John & Sons, Incorporated",9.78078E+12,2002,1,704,Mastering Visual Basic .NET Database Programming,Evangelos Petroutsos,Sybex,9.78078E+12,2002,1,960
Local Transcendence: Essays on Postmodern Historicism and the Database,Alan Liu,University of Chicago Press,9.78023E+12,2008,11,408,Local Transcendence: Essays on Postmodern Historicism and the Database,Alan Liu,University Of Chicago Press,9.78023E+12,2008,11,361
Local Transcendence: Essays on Postmodern Historicism and the Database,Alan Liu,University of Chicago Press,9.78023E+12,2008,11,408,Local Transcendence: Essays on Postmodern Historicism and the Database,Alan Liu,University Of Chicago Press,9.78023E+12,2008,11,408
Bioinformatics: Databases and Algorithms,N. Gautham,Alpha Science International,9.78184E+12,2006,1,400,Bioinformatics: Databases and Algorithms,N. Gautham,"Alpha Science International, Ltd",9.78184E+12,2006,1,248
Effective Oracle Database 10g Security by Design / Edition 1,"David Knox,David W. Carey,Lisa McClain",McGraw-Hill Professional Publishing,9.78007E+12,2004,5,544,Effective Oracle Database 10g Security by Design,"David C. Knox,Lisa McClain,David W. Carey",McGraw-Hill/Osborne Media,9.78007E+12,2004,7,512
Benchmark Handbook: For Database and Transaction Processing Systems,Jim Gray,Elsevier Science & Technology Books,9.78156E+12,1992,10,350,The Benchmark Handbook: For Database and Transaction Processing Systems,Jim  Gray,Morgan Kaufmann Publishers,9.78156E+12,1991,1,334
The Best Boring Book Ever of Select Healthcare Classification Systems and Databases,Katherine S. Rowell,HealthDataViz,9.78062E+12,2013,11,170,The Best Boring Book Ever of Select Healthcare Classification Systems and Databases,"Katherine S. Rowell,Ann Cutrell",Healthdataviz,9.78062E+12,2013,11,170
Database Marketing,Florian Weiss,diplom.de,9.78384E+12,2002,12,116,Database Marketing,Florian Weiss,Diplom.de,9.78384E+12,2002,12,116
Accounting Research Database (RLE Accounting),Bimal Prodhan,Taylor & Francis,9.78132E+12,2014,11,258,Accounting Research Database,Bimal Prodhan,Routledge,9.78131E+12,2014,6,258
Designing Effective Database Systems,Rebecca M. Riordan,Addison-Wesley,9.78032E+12,2005,1,353,Designing Effective Database Systems,Rebecca M. Riordan,Addison-Wesley Professional,9.78032E+12,2005,1,384
Relational Database Design Clearly Explained / Edition 2,"Jan L. Harrington,Harrington",Elsevier Science,9.78156E+12,2002,4,416,Relational Database Design Clearly Explained,Jan L. Harrington,Morgan Kaufmann Publishers,9.78156E+12,2002,4,416
"Database Systems: Design, Implementation, and Management (Book Only) / Edition 10",Carlos Coronel,Cengage Learning,9.78111E+12,2012,1,752,"Database Systems: Design, Implementation, and Management","Carlos Coronel,Steven Morris,Peter Rob",Cengage Learning,,2012,1,752
DataBase Developer's Guide with Visual C++ 4,"Sams Publishing,Jennings",Sams,9.78067E+12,1996,4,1104,Database Developer's Guide with Visual C++ 4,"Peter Hipson,Roger Jennings",Sams Publishing,9.78067E+12,1996,6,1000
Aspect-Oriented Database Systems / Edition 1,Awais Rashid,Springer Berlin Heidelberg,9.78354E+12,2004,1,176,Aspect-Oriented Database Systems,Awais Rashid,Springer,,2004,1,176
Pro ODP.NET for Oracle Database 11g,Edmund Zehoo,Apress,9.78143E+12,2010,4,468,Pro Odp.Net For Oracle Database 11g,Edmund Zehoo,Apress,9.78143E+12,2010,4,445
Database Easy,Kalman Toth,CreateSpace Publishing,9.78148E+12,2013,2,300,Database Easy,Kalman Toth,Createspace,9.78148E+12,2013,2,300
Active Database Systems: Triggers and Rules for Advanced Database Processing,"Jennifer Widom,Stefano Ceri",Elsevier Science,9.78156E+12,1995,9,332,Active Database Systems: Triggers and Rules for Advanced Database Processing,Jennifer Widom,Morgan Kaufmann Publishers,9.78156E+12,1995,9,332
Expert Oracle Database Architecture / Edition 3,Darl Kuhn,Apress,9.78143E+12,2014,11,824,Expert Oracle Database Architecture,Thomas Kyte,Apress,9.78143E+12,2014,11,824
Database Annotation in Molecular Biology: Principles and Practice / Edition 1,Arthur M. Lesk,Wiley,9.78047E+12,2004,1,266,Database Annotation in Molecular Biology: Principles and Practice,Arthur M. Lesk,Wiley,9.78047E+12,2005,1,266
OCA Oracle Database 11g: Database Administration I: A Real-World Certification Guide,Steve Ries,Packt Publishing,9.78185E+12,2013,2,0,Oracle Database 11g Administration I Certification Guide,Steve Ries,Packt Publishing,9.78185E+12,2013,2,582
High Performance Parallel Database Processing and Grid Database / Edition 1,David Taniar,Wiley,9.78047E+12,2008,10,0,High-Performance Parallel Database Processing and Grid Databases,"David Taniar,Wenny Rahayu",John Wiley & Sons,9.78047E+12,2008,9,551
Configuring and Tuning Databases on the Solaris Platform / Edition 1,"Allan N. Packer,Sun Microsystems Press",Prentice Hall,9.78013E+12,2001,12,552,Configuring and Tuning Databases on the Solaris Platform,"Allan N. Packer,Sun Microsystems Press Staff",Prentice Hall,9.78013E+12,2001,12,478
"Children's Literature: An Invitation to the World (with Children's Literature Database CD-ROM (PC only), Version 2.0) / Edition 1","Diana Mitchell,Pamela Waterbury,Rose Casement,Pamela Waterbury,Rose Casement",Pearson,9.78032E+12,2002,11,464,"Children's Literature: An Invitation to the World (with Children's Literature Database CD-ROM, Version 2.0)",Diana Mitchell,Allyn & Bacon,9.78032E+12,2002,11,464
"DB2 9 for Linux, UNIX, and Windows Advanced Database Administration Certification: Certification Study Guide","Roger E. Sanders,Dwaine R Snow",Mc Press,9.78158E+12,2008,11,650,"DB2 9 for Linux, UNIX, and Windows Database Administration: Certification Study Guide",Roger E. Sanders,Mc Press,9.78158E+12,2007,10,880
Upgrading Relational Databases with Objects,Robert Vermeulen,SIGS,9.78014E+12,1997,12,0,Upgrading Relational Databases with Objects,"Robert Vermeulen,Robert Vermulen",Sigs,9.78014E+12,1997,12,234
"A Computational Model of Natural Language Communication: Interpretation, Inference, and Production in Database Semantics / Edition 1",Roland R. Hausser,Springer Berlin Heidelberg,9.78354E+12,2006,9,365,"A Computational Model of Natural Language Communication: Interpretation, Inference, and Production in Database Semantics",Roland Hausser,Springer,9.78354E+12,2006,9,365
Constraint Databases / Edition 1,"Gabriel Kuper,Leonid Libkin,Jan Paredaens",Springer Berlin Heidelberg,9.78364E+12,2010,12,428,Constraint Databases,"Gabriel Kuper,Leonid Libkin,Jan Paredaens",Springer,9.78364E+12,2010,12,428
Databases and Mobile Computing,Daniel Barbara,Springer US,9.78079E+12,1996,7,86,Databases and Mobile Computing,Daniel Barbara,Springer,9.78079E+12,1996,7,86
DNA Databases,Lauri R Harding,Greenhaven Publishing,9.78074E+12,2007,8,100,DNA Databases,Lauri R Harding,Greenhaven Press,9.78074E+12,2007,8,100
DNA Databases,Lauri R Harding,Greenhaven Publishing,9.78074E+12,2007,8,100,DNA Databases,Lauri R. Harding,Greenhaven Press,9.78074E+12,2007,8,100
Object-Oriented Database Programming,Suad Alagic,Springer New York,9.78146E+12,2012,7,320,Object-Oriented Database Programming,Suad Alagic,Springer,9.78146E+12,2011,9,320
"Flash XML Applications: Use AS2 and AS3 to Create Photo Galleries, Menus, and Databases",Joachim Bernhard Schnier,Taylor & Francis,9.78024E+12,2007,10,336,"Flash XML Applications: Use AS2 and AS3 to Create Photo Galleries, Menus, and Databases [With CDROM]",Joachim Bernhard Schnier,Focal Press,9.78024E+12,2007,10,322
Query Processing in Database Systems,"W. Kim,D.S. Reiner,Don Batory",Springer Berlin Heidelberg,9.78364E+12,2011,12,366,Query Processing in Database Systems,"W. Kim,D. S. Reiner,D. S. Batory",Springer,9.78364E+12,2011,12,366
Introduction to Oracle 10G & Database CD Package / Edition 1,"James T. Perry,Gerald Post,Gerald V. Post",Prentice Hall,9.78013E+12,2005,12,659,Introduction to Oracle 10g & Database CD Package,"Brian Perry,Gerald V. Post",Prentice Hall,9.78013E+12,2005,12,659
Database Hacker's Handbook: Defending Database Servers,Bill Grindlay,Wiley,9.78076E+12,2005,7,532,The Database Hacker's Handbook: Defending Database Servers,"David Litchfield,Chris Anley,John Heasman,Bill Grindlay",Wiley Publishing,9.78076E+12,2005,7,500
"Studyguide for Database Systems: Design, Implementation and Management by Rob, Peter, ISBN 9781423902010",Cram101 Textbook Reviews,"Content Technologies, Inc.",9.78161E+12,2011,6,110,"Studyguide for Database Systems: Design, Implementation, and Management by Rob, Peter, ISBN 9781423938842",Cram101 Textbook Reviews,Cram101,9.78161E+12,2011,5,110
"Intelligent Databases: Object-Oriented, Deductive Hypermedia Technologies","Kamran Parsaye,Mark Chignell,Setrag Khoshafian,Harry Wong",Wiley,9.78047E+12,1989,5,496,"Intelligent Databases: Object-Oriented, Deductive Hypermedia Technologies","Kamran Parsaye,Setrag Khoshafian,Mark Chignell",Wiley,9.78047E+12,1989,5,496
Oracle Database 10g Rman Backup & Recovery / Edition 1,"Matthew Hart,Robert G. Freeman,Hart Matthew",McGraw-Hill Osborne Media,9.78007E+12,2006,11,666,Oracle Database 10g RMAN Backup & Recovery,"Matthew Hart,Robert G. Freeman",McGraw-Hill Education,9.78007E+12,2006,11,666
Objects and Databases,Petr Kroha,"McGraw-Hill Companies, The",9.78008E+12,1994,2,256,Objects And Databases,Petr Kroha,McGraw-Hill Companies,9.78008E+12,1994,2,244
Logical Database Design Princi,John Garmany,Taylor & Francis,9.78085E+12,2005,4,0,Logical Database Design Princi,"John Garmany,Jeff Walker,Terry Clark",Auerbach Publications,9.78085E+12,2005,4,180
Foundation for Object / Relational Databases: The Third Manifesto,"Hugh Darwen,Chris J. Date",Addison-Wesley,9.7802E+12,1998,6,528,Foundation for Object / Relational Databases: The Third Manifesto,"C.J. Date,Hugh Darwen",Addison-Wesley Professional,9.7802E+12,1998,6,528
Fundamentals of Relational Database Management Systems / Edition 1,"S. Sumathi,S. Esakkirajan",Springer Berlin Heidelberg,9.78364E+12,2010,11,0,Fundamentals of Relational Database Management Systems,"S. Sumathi,S. Esakkirajan",Springer,9.78364E+12,2010,11,776
"Building Intelligent Databases with Oracle PL/SQL, Triggers, and Stored Procedures","Kevin T. Owens,Kevin T. Owens",Prentice Hall Professional Technical Reference,9.78014E+12,1997,12,560,Building Intelligent Databases with Oracle PL/SQL [With Disk],Kevin T. Owens,Prentice Hall,9.78014E+12,1998,1,544
"Database Systems: Concepts, Management and Application","Alden Lorents,James Morgan",Harcourt College Publishers,9.78016E+12,1997,12,736,"Database Systems: Concepts, Management, and Applications","Alden C. Lorents,Lorents, Alden / Morgan, James Lorents, Alden / Morgan, James",Dryden Press,9.78016E+12,1997,11,736
MYSQL/PHP Database Applications / Edition 2,"Brad Bulger,Jay Greenspan,David Wall",Wiley,9.78076E+12,2003,10,816,MySQL / PHP Database Applications,"David Wall,Brad Bulger,Jay Greenspan",Wiley,9.78076E+12,2003,11,808
Oracle Databases on the Web,"Donald K. Burleson,Donald Burleson,Robert Papaj",Coriolis Group,9.78158E+12,1997,2,592,Oracle Databases on the Web,"Robert Papaj,Donald K. Burleson",Coriolis Group Books,9.78158E+12,1997,2,572
The Database Experts' Guide to SQL,Frank Lusardi,Intertext,9.78007E+12,1988,1,224,The Database Experts' Guide To Sql,Frank Lusardi,McGraw-Hill Companies,9.78007E+12,1988,5,238
Oracle Database 10g Real Application Clusters Handbook / Edition 1,"K Gopalakrishnan,Vijay Lunawat",McGraw-Hill Professional Publishing,9.78007E+12,2006,11,421,Oracle Database 10g Real Application Clusters Handbook,"K. Gopalakrishnan,Vijay Lunawat",McGraw-Hill/Osborne Media,9.78007E+12,2006,12,421
The Structure of the Relational Database Model,"Jan Paredaens,Paul De Bra,Marc Gyssens,Dirk van Gucht",Springer Berlin Heidelberg,9.78364E+12,2013,12,0,The Structure of the Relational Database Model,"Jan Paredaens,Paul De Bra,Marc Gyssens,Dirk Van Gucht",Springer,9.78364E+12,2013,10,233
Direct and Database Marketing,Graeme McCorkell,"Kogan Page, Ltd.",9.78075E+12,1997,9,320,Direct and Database Marketing,Graeme McCorkell,Kogan Page,9.78075E+12,1997,9,320
"Multi-Platform Database Consulting: Database Useage on Mainframe, Mid-Tier and NT Servers",John V. McLean,AuthorHouse,9.78142E+12,2004,11,444,"Multi-Platform Database Consulting: Database Useage on Mainframe, Mid-Tier and NT Servers",John V. McLean,Authorhouse,9.78142E+12,2004,11,444
Numeric Databases,"ABC-CLIO,Peter Hernon","ABC-CLIO, Incorporated",9.78089E+12,1984,1,304,Numeric Databases,"Ching-Chih Chen,Peter Hernon",Ablex Publishing Corporation,9.78089E+12,1984,5,304
Database Design,Gio C. Wiederhold,"McGraw-Hill Companies, The",9.78007E+12,1983,12,784,Database Design,Gio Wiederhold,McGraw-Hill Companies,9.78007E+12,1983,3,751
Lectures on SQL and Relational Database Design,John W Starner,CreateSpace Publishing,9.78148E+12,2012,11,176,Lectures on SQL and Relational Database Design,John W Starner,Createspace,9.78148E+12,2012,11,176
