ltable_title,ltable_authors,ltable_publisher,ltable_ISBN13,ltable_publishedYear,ltable_publishedMonth,ltable_pages,rtable_title,rtable_authors,rtable_publisher,rtable_ISBN13,rtable_publishedYear,rtable_publishedMonth,rtable_pages
Introduction to Database Management: A Practical Approach,Gerry M. Litton,McGraw-Hill Higher Education,9.7807E+12,1987,2,560,Introduction to Database Management: A Practical Approach,Gerry Litton,William C. Brown,9.7807E+12,1987,1,532
Oracle Performance Survival Guide: A Systematic Approach to Database Optimization,Guy Harrison,Pearson Education,9.78014E+12,2009,10,768,Oracle Performance Survival Guide: A Systematic Approach to Database Optimization,Guy Harrison,Prentice Hall PTR,9.78014E+12,2009,10,730
Mastering Oracle Scheduler In Oracle 11g Databases,Ronald Rood,Packt Publishing,9.78185E+12,2009,6,240,Mastering Oracle Scheduler in Oracle 11g Databases,Ronald Rood,Packt Publishing,9.78185E+12,2009,6,240
Oracle8i Database Administration,Noel Yuhanna,"O'Reilly Media, Incorporated",9.78188E+12,1999,12,543,Oracle8i Database Administration,Noel Yuhanna,Manning Publications,9.78188E+12,1999,11,543
Database Programming with JDBC and Java,"George Reese,Andy Oram","O'Reilly Media, Incorporated",9.78157E+12,2000,9,350,Database Programming with JDBC & Java,George Reese,O'Reilly Media,9.78157E+12,2000,8,350
"Bioinformatics: Experiments, Tools, Databases, and Algorithms","Orpita Bosu,Simminder Kaur Thukral","Oxford University Press, USA",9.7802E+12,2007,8,528,"Bioinformatics: Experiments, Tools, Databases, and Algorithms",Orpita Bosu,"Oxford University Press, USA",9.7802E+12,2007,9,528
"Pro Oracle Database 10g RAC on Linux: Installation, Administration, and Performance / Edition 1","John Shaw,Julian Dyke",Apress,9.78159E+12,2006,7,824,"Pro Oracle Database 10g RAC on Linux: Installation, Administration, and Performance","Julian Dyke,Steve Shaw",Apress,9.78159E+12,2006,7,795
Invitation to Database Processing,Leonard Gorney,Petrocelli Books,9.78089E+12,1985,12,276,Invitation to database processing,Leonard Gorney,Petrocelli Books,9.78089E+12,1985,12,269
Miriad: Report of the Midwifery Research Database,"Felicia McCormick,Mary Renfrew",Elsevier Health Sciences,9.7819E+12,1998,1,120,Midwifery Research Database Miriad Sup 1: Report of the Midwifery Research Database,"Felicia McCormick,Mary J. Renfrew",Books for Midwives Press,9.7819E+12,1997,3,120
Recipes for Continuous Database Integration: Evolutionary Database Development (Digital Short Cut),Pramod J. Sadalage,Pearson Education,9.78013E+12,2003,3,56,Recipes for Continuous Database Integration: Evolutionary Database Development (Digital Short Cut),Pramodkumar J. Sadalage,Addison-Wesley Professional,9.78013E+12,2003,3,56
Analytic Mapping and Geographic Databases,"G. David Garson,Robert S. Biggs",SAGE Publications,9.7808E+12,1992,6,0,Analytic Mapping and Geographic Databases,G. Garson,"Sage Publications, Inc",9.7808E+12,1992,6,96
DB2 10 for z/OS Database Administration: Certification Study Guide,"Susan Lawson,Daniel Luksetich",Mc Press,9.78158E+12,2012,4,1008,DB2 10 for Z/OS Database Administration: Certification Study Guide,"Susan Lawson,Daniel Luksetich",MC Press,9.78158E+12,2012,4,1008
Intelligent Database Systems,"Elisa Bertino,Gian Piero Zarri,Barbara Catania,Gian Piero Zarri,Barbara Catania",Addison Wesley Professional,9.7802E+12,2001,2,352,Intelligent Database Systems,"Elisa Bertino,Barbara Catania",Addison-Wesley Professional,9.7802E+12,2001,2,452
Updating Logical Databases,"Marianne Winslett,C. J. Van Rijsbergen,Samson Abramsky",Cambridge University Press,9.78052E+12,2004,12,0,Updating Logical Databases,Marianne Winslett,Cambridge University Press,9.78052E+12,2004,12,224
Database Searching in College Libraries,Sarah Pederson,American Library Association,9.78084E+12,1993,1,123,Database Searching in College Libraries,Sarah Pederson,Association of College & Research Libraries,9.78084E+12,1993,1,119
Business and Management: Bibliographic Databases,"Marydee Ojala,Edmund Mignon",Database Services,9.78094E+12,1981,6,148,Business & Management: Bibliographic Databases,"Marydee Ojala,Edmund Mignon",Database Services,9.78094E+12,1981,6,148
Database Principles and Design,Colin Ritchie,Cengage Learning EMEA Higher Education,9.78184E+12,2008,4,544,Database Principles and Design,Colin Ritchie,Cengage Learning,9.78184E+12,2008,3,388
Database Systems Engineering,"R. P. Whittington,Whittington","Oxford University Press, USA",9.7802E+12,1988,12,448,Database Systems Engineering,R. P. Whittington,"Oxford University Press, USA",9.7802E+12,1988,12,448
"Save The Database, Save The World",John Ottman,Lulu.com,9.78146E+12,2011,6,170,"Save the Database, Save the World",John Ottman,Lulu.com,9.78146E+12,2011,6,170
"Save The Database, Save The World",John Ottman,Lulu.com,9.78146E+12,2011,6,170,"Save the Database, Save the World",John Ottman,Lulu.com,9.78056E+12,2011,6,170
The Complete Guide to Java Database Programming (Java Masters Series),"Mathew Siple,Matthew D. Siple,Siple","McGraw-Hill Companies, The",9.78008E+12,1997,12,333,The Complete Guide to Java Database Programming with FDBC,"Matthew D. Siple,McGraw-Hill Education",McGraw-Hill Companies,9.78008E+12,1997,12,333
Database Management and Design / Edition 2,Gary W. Hansen,Prentice Hall,9.78013E+12,1995,9,582,Database Management and Design,Gary W. Hansen,Prentice Hall,9.78013E+12,1995,9,582
Small Scale Bibliographic Databases,"Brenda Gerrie Peter Judge,Brenda Gerrie,Peter Judge",Emerald Group Pub Ltd,9.78012E+12,1986,8,198,Small Scale Bibliographic Databases,Peter J. Judge,Emerald Group Publishing,9.78012E+12,1986,8,198
Multimedia Database Retrieval: A Human-Centered Approach / Edition 1,"Paisarn Muneesawang,Ling Guan",Springer US,9.78039E+12,2006,9,188,Multimedia Database Retrieval: A Humancentered Approach,"Ling Guan,Paisarn Muneesawang",Springer Science+Business Media,9.78039E+12,2006,1,186
Multimedia Database Retrieval: A Human-Centered Approach / Edition 1,"Paisarn Muneesawang,Ling Guan",Springer US,9.78039E+12,2006,9,188,Multimedia Database Retrieval: A Human-Centered Approach,Paisarn Muneesawang,Springer,9.78039E+12,2006,8,186
Winning Telco Customers Using Marketing Databases,Rob Mattison,"Artech House, Incorporated",9.78158E+12,1999,10,338,Winning Telco Customers Using Marketing Databases,Rob Mattison,Artech House Publishers,9.78158E+12,1999,1,344
Beginning MySQL Database Design and Optimization: From Novice to Professional,"Chad Russell,Jon Stephens",Apress,9.78159E+12,2004,10,520,Beginning MySQL Database Design and Optimization: From Novice to Professional,Jon Stephens,Apress,9.78159E+12,2004,10,500
Database: ECDL - the European PC standard,Bill McTaggart,Springer London,9.78185E+12,2001,1,0,Database: Ecdl - The European PC Standard,Bill McTaggart,Springer,9.78185E+12,2001,1,118
Relational Database Management for Microcomputers: Design and Implementation,Jan L. Harrington,Harcourt College Publishers,9.78003E+12,1988,4,378,Relational Database Management for Microcomputers: Design and Implementation,Jan L. Harrington,Delmar,9.78003E+12,1987,12,378
Beginning ASP.NET 2.0 and Databases,"John Kauffman,Bradley Millington",Wiley,9.78047E+12,2006,7,535,Beginning ASP.Net 2.0 and Databases,John Kauffman,Wrox Press,9.78047E+12,2006,7,535
Online and CD-ROM Databases in School Libraries: Readings,"Ann Lathrop,Carol Tenopir",Libraries Unlimited,9.78087E+12,1989,6,0,Online and Cd-Rom Databases in School Libraries: Readings (Database Searching Series),Ann Lathrop,Libraries Unlimited Inc,9.78087E+12,1989,9,372
Principles of Distributed Database Systems / Edition 2,M. Tamer Ozsu,Prentice Hall,9.78014E+12,1999,1,666,Principles of Distributed Database Systems,M. Tamer Ozsu,Prentice Hall,9.78014E+12,1999,1,666
Pro Active Record: Databases with Ruby and Rails,"Chad Pytel,Jon Yurek,Kevin Marshall",Apress,9.78159E+12,2007,9,304,Pro Active Record: Databases with Ruby and Rails,Kevin Marshall,Apress,9.78159E+12,2007,6,280
Oracle Database 11g Administration I Certification Guide,Steve Ries,Packt Publishing,9.78185E+12,2013,2,582,Oracle Database 11g Administration I Certification Guide,Steve Ries,Packt Publishing,9.78185E+12,2013,2,582
Oracle on VMware: Expert Tips for Database Visualization,Bert Scalzo,Rampant Techpress,9.78098E+12,2008,9,223,Oracle on VMware: Expert Tips for Database Visualization,Bert Scalzo,Rampant Techpress,9.78098E+12,2008,9,232
"DB2 Universal Database V8.1 for Linux, UNIX, and Windows Database Administration Certification Guide, Fifth Edition / Edition 5","George Baklarz,Bill Wong",IBM Press,9.78013E+12,2003,2,912,"DB2 Universal Database V8 for Linux, Unix, and Windows Database Administration Certification Guide [With CDROM]","George Baklarz,Bill Wong",IBM Press,9.78013E+12,2003,2,912
Database Transportation,June Loves,Chelsea House Publishers,9.78079E+12,2005,9,32,Database Transportation,Chelsea House Publishers,Chelsea House Publications,9.78079E+12,2005,9,32
Building Database Driven Catalogs,"Sherif Danish,Patrick Gannon","McGraw-Hill Companies, The",9.78007E+12,1998,5,300,Building Database Driven Web Catalogs,Sherif Danish,McGraw-Hill Education,9.78007E+12,1998,5,300
Sybase Database Administrator's Handbook,Brian Hitchcock,Prentice Hall Professional Technical Reference,9.78013E+12,1995,11,520,Sybase Database Administrator's Handbook,Brian Hitchcock,Prentice Hall PTR,9.78013E+12,1995,11,520
Advances in Intelligent Information and Database Systems,"Ngoc Thanh Nguyen,Radoslaw Katarzyniak",Springer Berlin Heidelberg,9.78364E+12,2012,4,2010,Intelligent Information and Database Systems,"Ngoc Thanh Nguyen,Chong-gun Kim,Adam Janiak",Springer,9.78364E+12,2011,4,600
Advances in Intelligent Information and Database Systems,"Ngoc Thanh Nguyen,Radoslaw Katarzyniak",Springer Berlin Heidelberg,9.78364E+12,2012,4,2010,Intelligent Information and Database Systems,"Ngoc Thanh Nguyen,Chong-gun Kim,Adam Janiak",Springer,9.78364E+12,2011,4,610
Beginning ASP.NET Databases using C#,"KAUFFMAN,Matt Butler,Eric Mintz,Fabio Claudio Ferrachiati,Jan Narkewicz",Apress,9.78186E+12,2002,7,500,Beginning ASP.Net Databases Using C#,"Jesudas Chinnathampi,Erix Mintz,John West,James Greenwood,Donald Xie,Brian Matsik,Jan D. Narkiewicz,Matt Butler,Kent Tegels,Jan Narkewicz,Fabio Claudio Ferrachiati,Eric Mintz,Fabio Ferracchiati",Wrox Press,9.78186E+12,2002,7,480
Database Developer's Guide with Visual Basic 3.0,Roger Jennings,Sams,9.78067E+12,1993,12,1130,Database Developer's Guide with Visual Basic 3,Roger Jennings,Sams,9.78067E+12,1994,1,1130
Beginning Visual Basic 2005 Databases,Thearon Willis,Wiley,9.78076E+12,2005,11,768,Beginning Visual Basic 2005 Databases,Thearon Willis,Wrox Press,9.78076E+12,2005,10,736
Database Design and Development: An Essential Guide for IT Professionals / Edition 1,Paulraj Ponniah,Wiley,9.78047E+12,2003,9,768,Database Design and Development: An Essential Guide for It Professionals,Paulraj Ponniah,Wiley-IEEE Press,9.78047E+12,2003,4,768
"Databases for Small Business: Essentials of Database Management, Data Analysis, and Staff Training for Entrepreneurs and Professionals",Anna Manning,Apress,9.78148E+12,2015,11,318,"Databases for Small Business: Essentials of Database Management, Data Analysis, and Staff Training for Entrepreneurs and Professionals",Anna Manning,Apress,9.78148E+12,2015,11,318
Demystifying Databases: A Hands-on Guide to Database Management,Shiva Sukula,Ess Ess Publications,9.78817E+12,2008,10,296,Demystifying Databases: A Hands-On Guide to Database Management,Shiva Sukula,Ess Ess Publication,9.78817E+12,2008,10,296
WordNet: An Electronic Lexical Database,"Christiane Fellbaum,George Miller",MIT Press,9.78026E+12,1998,5,449,Wordnet: An Electronic Lexical Database,Christiane Fellbaum,Bradford Book,9.78026E+12,1998,5,449
Database Support for Software Engineering,A. W. Brown,Wiley,9.78047E+12,1989,11,194,Database Support For Software Engineering,Alan Brown,John Wiley & Sons,9.78047E+12,1989,11,194
Beginning C# 2008 Databases: From Novice to Professional / Edition 1,"Syed Fahad Gilani,Vidya Vrat Agarwal,Jon Reid,Ranga Raghuram,James Huddleston",Apress,9.78159E+12,2008,1,482,Beginning C# 2008 Databases: From Novice to Professional,"James Huddleston,Ranga Raghuram",Apress,9.78159E+12,2007,10,482
Beginning C# 2008 Databases: From Novice to Professional / Edition 1,"Syed Fahad Gilani,Vidya Vrat Agarwal,Jon Reid,Ranga Raghuram,James Huddleston",Apress,9.78159E+12,2008,1,482,Beginning VB 2008 Databases: From Novice to Professional,"Vidya Vrat Agarwal,James Huddleston",Apress,9.78159E+12,2008,4,409
Beginning C# 2008 Databases: From Novice to Professional / Edition 1,"Syed Fahad Gilani,Vidya Vrat Agarwal,Jon Reid,Ranga Raghuram,James Huddleston",Apress,9.78159E+12,2008,1,482,Beginning C# 2005 Databases: From Novice to Professional,"James Huddleston,Syed Fahad Gilani,Ranga Raghuram",Apress,9.78159E+12,2007,1,500
Beginning C# 2008 Databases: From Novice to Professional / Edition 1,"Syed Fahad Gilani,Vidya Vrat Agarwal,Jon Reid,Ranga Raghuram,James Huddleston",Apress,9.78159E+12,2008,1,482,Beginning C# 2008 Databases: From Novice to Professional,"Vidya Vrat Agarwal,James Huddleston,Ranga Raghuram,Fahad Syed Gilani,Hammer Jacob Pedersen,Jon Reid","Springer-Verlag New York, LLC",9.78143E+12,2008,1,512
Active Rules in Database Systems,Norman W. Paton,Springer New York,9.78146E+12,2013,12,439,Active Rules in Database Systems,Norman W Paton,Springer,9.78146E+12,2012,9,439
Database Design Fundamentals,Michael J. Hernandez,"Pinnacle Publishing, Incorporated",9.78188E+12,1995,8,62,Database Design Fundamentals,Michael J. Hernandez,Pinnacle Pub.,9.78188E+12,1995,12,62
Java Database Best Practices,"George Reese,Brett McLaughlin","O'Reilly Media, Incorporated",9.7806E+12,2003,5,288,Java Database Best Practices,George Reese,O'Reilly Media,9.7806E+12,2003,5,288
Caching And Materialization For Web Databases,Alexandros Labrinidis,Now Publishers,9.7816E+12,2010,2,112,Caching and Materialization for Web Databases,Alexandros Labrinidis,Now Publishers,9.7816E+12,2010,2,112
Database Explorations: Essays on the Third Manifesto and Related Topics,"C. J. Date,Hugh Darwen",Trafford Publishing,9.78143E+12,2010,7,548,Database Explorations: Essays on the Third Manifesto and Related Topics,"C.J. Date,Hugh Darwen",Trafford Publishing,9.78143E+12,2010,7,548
Database Security and Auditing: Protecting Data Integrity and Accessibility / Edition 1,Hassan A. Afyouni,Cengage Learning,9.78062E+12,2005,4,448,Database Security and Auditing: Protecting Data Integrity and Accessibility,Hassan A. Afyouni,Course Technology,9.78062E+12,2005,4,429
Models and Lanuages of Object-Oriented Databases,"Georg Lausen,Gottfried Vossen",Addison-Wesley,9.7802E+12,1997,10,218,Models and Languages of Object-Oriented Databases,"Georg Lausen,Gottfried Vossen",Addison Wesley Longman,9.7802E+12,1998,1,218
JDBC 3.0: JAVA Database Connectivity,Bernard Van Haecke,Wiley,9.78076E+12,2002,2,600,JDBC 3.0: Java Database Connectivity,Bernard Van Haecke,Wiley,9.78076E+12,2002,1,600
Bioinformatics Database Systems,"Kevin Byron,Katherine G. Herbert,Jason T.L. Wang",Taylor & Francis,9.78144E+12,2016,10,300,Bioinformatics Database Systems,Jason T.L. Wang,CRC Press,9.78144E+12,2016,11,300
Creating Database Web Applications With PHP and ASP / Edition 1,Jeanine Meyer,Cengage Learning,9.78158E+12,2003,6,411,Creating Database Web Applications with PHP and ASP,Jeanine Meyer,Charles River Media,9.78158E+12,2003,6,411
Grid Computing Database: Using Oracle Database,Dr. Peter Archibong,CreateSpace Publishing,9.78151E+12,2015,2,38,Grid Computing Database: Using Oracle Database,Dr Peter Archibong,Createspace Independent Publishing Platform,9.78151E+12,2015,2,38
Cold Fusion 2.0 Web Database Construction Kit,"Ben Forta,David Watts,Leon Chalnick,David E. Crawford,Steven D. Drucker",Que,9.78079E+12,1996,12,832,The Cold Fusion Web Database Construction Kit,"Ben Forta,Leon Chalnick,David Watts",Que,9.78079E+12,1997,2,786
Handbook of Carcinogenic Potency and Genotoxicity Databases,"Lois Swirsky Gold,Errol Zeiger",Taylor & Francis,9.78085E+12,1996,11,768,Handbook of Carcinogenic Potency and Genotoxicity Databases,Lois Swirsky Gold,CRC Press,9.78085E+12,1996,11,768
Multimedia Database Management Systems,Guojun Lu,"Artech House, Incorporated",9.78089E+12,1999,9,400,Multimedia Database Management Systems,Guojun Lu,Artech House Publishers,9.78089E+12,1999,9,373
Practical Issues in Database Management: A Reference for the Thinking Practitioner / Edition 1,Fabian Pascal,Addison-Wesley,9.7802E+12,2000,5,288,Practical Issues in Database Management: A Reference for the Thinking Practitioner,Fabian Pascal,Addison-Wesley Professional,9.7802E+12,2000,6,288
Java 2 Database Programming for Dummies,"Jim Keogh,James Edward Keogh",Wiley,9.78076E+12,2001,10,408,Java 2 Database Programming for Dummies Java 2 Database Programming for Dummies Java 2 Database Programming for Dummies Java 2 Database Programming for Dummies,Jim Keogh,For Dummies,9.78076E+12,2001,10,408
Blackstone's Police Operational Handbook 2016: Law & Practice and Procedure Pack,"Police National Legal Database (PNLD),Ian Bridges,Fraser Sampson,Clive Harfield",Oxford University Press,9.7802E+12,2015,12,1616,Blackstone's Police Operational Handbook 2016: Law & Practice and Procedure Pack,"Police National Legal Database (PNLD),Ian Bridges,Fraser Sampson,Clive Harfield","Oxford University Press, USA",9.7802E+12,2015,12,1616
Foundations of Databases: The Logical Level / Edition 1,Serge Abiteboul,Pearson,9.7802E+12,1995,1,685,Foundations of Databases: The Logical Level,"Serge Abiteboul,Richard   Hull",Pearson,9.7802E+12,1994,12,685
Database Applications Semantics / Edition 1,L. Mark,Springer US,9.78041E+12,1996,10,613,Database Applications Semantics,Meersman,Springer,9.78041E+12,1996,10,613
"Fuzzy Databases: Modeling, Design and Implementation","Galindo,Mario Piattini,Angelica Urrutia",IGI Global,9.78159E+12,2005,10,300,"Fuzzy Databases: Modeling, Design, And Implementation",Jose Galindo,IGI Global,9.78159E+12,2005,10,320
"PHP & MySQL: Your Visual Blueprint for Creating Dynamic, Database Driven Web Sites",Janet Valade,Wiley,9.78047E+12,2006,9,0,"PHP & MySQL: Your Visual Blueprint for Creating Dynamic, Database-Driven Web Sites",Janet Valade,Visual,9.78047E+12,2006,9,307
Open Source XML Database Toolkit: Resources and Techniques,"Liam R. E. Quin,Cary Sullivan",Wiley,9.78047E+12,2000,7,448,Open Source XML Database Toolkit: Resources and Techniques for Improved Development,"Liam Quin,Cary Sullivan",Wiley,9.78047E+12,2000,8,448
Building a Columnar Database on RAMCloud: Database Design for the Low-Latency Enabled Data Center,Christian Tinnefeld,Springer International Publishing,9.78332E+12,2015,8,130,Building a Columnar Database on Ramcloud: Database Design for the Low-Latency Enabled Data Center,Christian Tinnefeld,Springer,9.78332E+12,2015,7,130
OCP Oracle Database 10g: New Features for Administrators Exam Guide / Edition 1,Sam R. Alapati,McGraw-Hill Professional Publishing,9.78007E+12,2004,10,688,Ocp Oracle Database 10g: New Features for Administrators Exam Guide,Sam Alapati,McGraw-Hill Education,9.78007E+12,2004,10,688
Image Databases and Multi-Media Search,"Ramesh Jain,Arnold W M Smeulders","World Scientific Publishing Company, Incorporated",9.78981E+12,1998,3,328,Image Databases And Multi Media Search,"Ramesh Jain,Arnoldus Wilhelmus Maria Smeulders,Arnold Smeulders",World Scientific Publishing Company,9.78981E+12,1998,1,328
Creating Cool Web Databases,"Joseph T. Sinclair,Carol McCullough-Dieter","Wiley, John & Sons, Incorporated",9.78076E+12,1996,10,464,Creating Cool Web Databases,"Joseph T. Sinclair,Carol McCullough-Dieter",John Wiley & Sons Inc (Computers),9.78076E+12,1996,10,469
A Pascal Database Book,Julian Ullman,"Oxford University Press, USA",9.7802E+12,1986,2,280,A Pascal Database Book,"Julian Ullmann,Julian Ullman","Oxford University Press, USA",9.7802E+12,1986,2,280
Storage and Retrieval for Media Databases 2000,"Charles A. Bouman,Boon-Lock Yeo,Minerva M. Yeung",SPIE Press,9.78082E+12,1999,12,592,Storage and Retrieval for Media Databases,"Minerva M. Yeung,Charles A. Bouman,Boon Lock Yeo",SPIE-International Society for Optical Engine,9.78082E+12,1999,12,616
Database Systems,Tsai,Prentice Hall Professional Technical Reference,9.78013E+12,1988,3,572,Database Systems,Alice Tsai,Prentice Hall,9.78013E+12,1988,3,572
"Studyguide for Database Systems: Design, Implementation, and Management by Rob, Peter, ISBN 9781423938842",Cram101 Textbook Reviews,"Content Technologies, Inc.",9.78161E+12,2011,5,110,"Studyguide for Database Systems: Design, Implementation, and Management by Rob, Peter, ISBN 9781423938842",Cram101 Textbook Reviews,Cram101,9.78161E+12,2011,5,110
Visual C++ Database Programming Tutorial,Wendy Sarrett,"Wrox Press, Inc.",9.78186E+12,1998,11,326,Visual C++ 6 Database Programming Tutorial,Wendy Sarrett,Wrox Press,9.78186E+12,1998,11,327
Similarity Joins in Relational Database Systems,"Michael Bohlen,Michael H. Bohlen",Morgan & Claypool Publishers,9.78163E+12,2013,10,126,Similarity Joins in Relational Database Systems,"Nikolaus Augsten,Michael H. Böhlen",Morgan & Claypool,9.78163E+12,2013,11,126
Relational Database Management with Oracle / Edition 2,Fred Rolland,Addison-Wesley,9.7802E+12,1992,1,288,Relational Database Management with Oracle,Fred D. Rolland,Addison Wesley Publishing Company,9.7802E+12,1991,11,268
Databases in Depth: The Relational Model for Practitioners,C. J. Date,"O'Reilly Media, Incorporated",9.7806E+12,2005,5,232,Database in Depth: Relational Theory for Practitioners,C.J. Date,O'Reilly Media,9.7806E+12,2005,5,232
SAP Database Administration with Oracle,"Andre Faustmann,Michael Hoding,Gunnar Klein,Ronny Zimmermann","Rheinwerk Publishing, Inc.",9.78159E+12,2008,3,818,SAP Database Administration with Oracle,"Michael Hoding,Michael H?ding,Andr? Faustmann,Gunnar Klein,Ronny Zimmermann","SAP PRESS, 1st edition",9.78159E+12,2008,5,812
Relational Database Design with Microcomputer Applications,Glenn A. Jackson,Prentice Hall Professional Technical Reference,9.78014E+12,1987,10,256,Relational Database Design with Microcomputer Applications,Glenn A. Jackson,Prentice Hall,9.78014E+12,1988,10,207
Delphi/Kylix Database Development,Eric Harmon,Pearson Education,9.78067E+12,1901,10,432,Delphi/Kylix Database Development,Eric Harmon,Sams,9.78067E+12,2001,10,432
Professional iPhone and iPad Database Application Programming,Patrick Alessi,Wiley,9.78047E+12,2010,10,408,Professional iPhone and iPad Database Application Programming,Patrick Alessi,Wrox Press,9.78047E+12,2010,10,375
Logics for Emerging Applications of Databases,"Jan Chomicki,Ron van der Meyden,Gunter Saake",Springer Berlin Heidelberg,9.78364E+12,2013,1,368,Logics for Emerging Applications of Databases,"Jan Chomicki,Ron van der Meyden,Gunter Saake",Springer,9.78364E+12,2012,10,368
Database,Malcolm Atkinson,Elsevier Science & Technology Books,9.78008E+12,1982,1,623,Database,Malcolm Atkinson,Pergamon,9.78008E+12,1981,12,623
Database Marketing: Analyzing and Managing Customers / Edition 1,"Robert C. Blattberg,Scott A. Neslin,Byung-Do Kim",Springer New York,9.78144E+12,2009,4,2008,Database Marketing: Analyzing and Managing Customers,"Robert C. Blattberg,Scott A. Neslin,Byung-Do Kim",Springer,9.78144E+12,2009,4,871
Probabilistic Databases,"Dan Suciu,Dan Olteanu,Christoph Koch",Morgan & Claypool Publishers,9.78161E+12,2011,6,182,Probabilistic Databases,"Dan Suciu,Dan Olteanu",Morgan & Claypool,9.78161E+12,2011,7,180
Information Modeling and Relational Databases: From Conceptual Analysis to Logical Design / Edition 1,"Terry Halpin,T. A. Halpin",Elsevier Science,9.78156E+12,2001,4,761,Information Modeling and Relational Databases: From Conceptual Analysis to Logical Design,Terry Halpin,Morgan Kaufmann Publishers,9.78156E+12,2001,4,761
Oracle Database 10g DBA Handbook / Edition 1,"Kevin Loney,Bob Bryla",McGraw-Hill Professional Publishing,9.78007E+12,2005,3,736,Oracle Database 10g DBA Handbook,"Kevin  Loney,Bob Bryla",McGraw-Hill Education,9.78007E+12,2005,4,736
Oracle Database 10g DBA Handbook / Edition 1,"Kevin Loney,Bob Bryla",McGraw-Hill Professional Publishing,9.78007E+12,2005,3,736,Oracle Database 10g DBA Handbook,"Kevin Loney,Bob Bryla",McGraw-Hill Education,9.78007E+12,2005,4,736
Jeffrey McManus' Database Access with Visual Basic 6,Jeffrey P. McManus,Sams,9.78067E+12,1999,1,840,Jeffrey McManus' Database Access with Visual Basic 6 [With Contains Source Code from the Book...],Jeffrey P. McManus,Sams,9.78067E+12,1999,1,840
Oracle Database Administration for Microsoft SQL Server DBAs / Edition 1,Michelle Malcher,McGraw-Hill Professional Publishing,9.78007E+12,2010,9,352,Oracle Database Administration for Microsoft SQL Server DBAs,Michelle Malcher,Oracle Press,9.78007E+12,2010,9,334
New Directions for Database Systems,"James Clifford,Gad Ariav","Intellect, Limited",9.78089E+12,1986,5,288,New Directions for Database Systems,"Gadi Ariav,James Clifford",Intellect Ltd,9.78089E+12,1986,5,280
DB2 9 for Z/OS Database Administration: Certification Study Guide,"Susan Lawson,Daniel Luksetich",Mc Press,9.78158E+12,2008,1,785,DB2 9 for z/OS Database Administration: Certification Study Guide,"Susan Lawson,Daniel Luksetich",Mc Press,9.78158E+12,2008,1,785
Fundamentals of Database Systems/Oracle 9i Programming,"Ramez Elmasri,Shamkant B. Navathe,Rajshekhar Sunderraman",Addison Wesley,9.78032E+12,2003,7,0,Fundamentals of Database Systems/Oracle 9i Programming,"Ramez Elmasri,Shamkant B. Navathe,Rajshekhar Sunderraman",Addison Wesley Longman,9.78032E+12,2003,8,0
Creating Database-Backed Library Web Pages,Stephen R. Westman,ALA Editions,9.78084E+12,2006,4,282,Creating Database-Backed Library Web Pages: Using Open Source Tools,Stephen R. Westman,American Library Association,9.78084E+12,2006,4,268
